"at the same time, or they can watch Vanilla Arena’s favourites like reruns of “Leave it to Beaver” or reruns of Yankee movies. Will watch to see Messi, De Paul, Mac Allister, Alvarez and Simeone make a mockery of the Ozzies! I hope you are wrong. ps, didn’t know you are a backer of Vanilla Arena","Thu Jun 15, 2023 1:52 pm",12,1353,"Australian National Football Teams - Socceroos, Olyroos, Matildas  etc",Argentina 🇦🇷 v Australia 🇦🇺 Thursday 15 June 9.30pm.
"at the same time, or they can watch Vanilla Arena’s favourites like reruns of “Leave it to Beaver” or reruns of Yankee movies. Will watch to see Messi, De Paul, Mac Allister, Alvarez and Simeone make a mockery of the Ozzies!","Wed Jun 14, 2023 1:38 pm",12,1353,"Australian National Football Teams - Socceroos, Olyroos, Matildas  etc",Argentina 🇦🇷 v Australia 🇦🇺 Thursday 15 June 9.30pm.
$400 Million????,"Fri May 05, 2023 10:52 am",2,1187,World Football,Lionel Messi wear his new Shirts makes Paris Saint-Germain debut
Messi Gonski 1.95507632,"Wed May 03, 2023 11:11 pm",2,1187,World Football,Lionel Messi wear his new Shirts makes Paris Saint-Germain debut
"bloody professional footballers, but they still haven't worked out that Saka goes left, almost every single time. Been saying the same about Messi for along time now So now you're comparing Saka with Messi heh? ;-)","Mon Jan 23, 2023 9:15 pm",776,49960,World Football,EPL 22/23
Been saying the same about Messi for along time now,"Mon Jan 23, 2023 8:00 pm",776,49960,World Football,EPL 22/23
A great final. Well played by both. Two champions in Messi and Mbappe. The second Argentine goal was brilliant. Something you would expect on a PlayStation game. This tweet has a Spanish and English commentary on the winning penalty. Quite a difference,"Mon Dec 19, 2022 10:46 pm",546,30935,World Football,World Cup 2022 Forum
A great final. Well played by both. Two champions in Messi and Mbappe. THe sesecond Argentine goal was brilliant. Something you would expect on a PlayStation game. This tweet has a Spanish and English commentary on the winning penalty. Quite a difference,"Mon Dec 19, 2022 10:04 pm",546,30935,World Football,World Cup 2022 Forum
"Hope the Argies can do it, have no allegiances but love what Messi has done for this wonderful game I would echo your sentiments- nothing against the French but would be the perfect time for Messi to retire from international football with a win. He has","Mon Dec 19, 2022 8:57 am",546,30935,World Football,World Cup 2022 Forum
"Hope the Argies can do it, have no allegiances but love what Messi has done for this wonderful game","Sun Dec 18, 2022 9:58 am",546,30935,World Football,World Cup 2022 Forum
"Mbappe? As for Argentina’s 🇦🇷 QF against the Netherlands 🇳🇱 I enjoyed that intriguing game. It was war. 17 yellow cards with both skippers, Lionel Messi and Virgil van Dijk, amongst those booked. Argentina survived that maelstrom and the next test in the Semi-Final. They also now get an extra day’s","Thu Dec 15, 2022 10:15 am",546,30935,World Football,World Cup 2022 Forum
"Two of my least favourite teams, a bit like watching Arsenal play Chelsea  A popular final in Qatar though, Messi v Mbappe, who both play for PSG, who are owned by..?No wonder we've seen some dubious refereeing.","Thu Dec 15, 2022 8:47 am",546,30935,World Football,World Cup 2022 Forum
"played mainly on count attack which to me is pretty poor if you have a team of top players ,not to mention going down for any close contact-Messi included. I am bitter that my Croat legendary midfield was useless & hardly any shots on goal, Argentine left side was always open, Mathew Lecki","Wed Dec 14, 2022 3:56 pm",546,30935,World Football,World Cup 2022 Forum
"I was trying to find a photo I saw on C7 news of the Day 7 MOTM trophy winners.Lewandoski, Messi, Mbappe and Mitchell Duke. What company to be in. I hope Messi appreciates the company he is in.","Sun Nov 27, 2022 7:50 pm",546,30935,World Football,World Cup 2022 Forum
"have claimed to have scored more but his goals were all scored in Official matches - no friendlies or pre-season or unofficial matches. How did Messi get the Ballon D'Or for this year when he's really done very little this season, how many goals?, whereas Ronaldo has been knocking goals in all","Wed Dec 08, 2021 4:00 pm",445,42394,World Football,EPL 21/22
ManU loosing to Young Boys a shock. Ronny still keeps scoring. Totally a machine. Is the Barca era coming to a close with no Messi.,"Wed Sep 15, 2021 1:12 pm",66,6403,World Football,UEFA Champions League 21/22
Sending the contingent of traveling PSG fans wild when Messi did finally step onto the pitch in a shirt other than that of Barcelona for the first time in his career. There were brief flashes of the brilliance fans have become accustomed to when watching,"Mon Sep 13, 2021 11:31 am",2,1187,World Football,Lionel Messi wear his new Shirts makes Paris Saint-Germain debut
So will PSG then loan him out to Adelaide United?,"Wed Aug 11, 2021 2:47 pm",5,1077,World Football,Leo Messi to sign for Tottenham
Messi off to PSG for $200m over 2 years .,"Tue Aug 10, 2021 10:34 pm",5,1077,World Football,Leo Messi to sign for Tottenham
still wouldn't win the Spuds a trophy,"Fri Aug 06, 2021 10:43 am",5,1077,World Football,Leo Messi to sign for Tottenham
Don't forget you will have to pay his taxes as well on top of his salary.,"Fri Aug 06, 2021 9:24 am",5,1077,World Football,Leo Messi to sign for Tottenham
Silly man. You should know by now he is coming to Adelaide United!,"Fri Aug 06, 2021 9:07 am",5,1077,World Football,Leo Messi to sign for Tottenham
"Mouse? And look at some of the other gold medal winners like Spain 🇪🇸 with the likes of Xavi, Puyol, & Gaurdiola playing, then Argentina with Messi, Tevez, Aguero, Riquelme, Di Maria, Mascherano & Zabaleta. What about gold medal winners Brazil with Neymar, Jesus, Thiago and Ronaldinho & Adriano","Fri Aug 06, 2021 9:06 am",161,20115,"Australian National Football Teams - Socceroos, Olyroos, Matildas  etc",Tough draws for  Olyroos and Matildas @ Tokyo/Japan
Then I woke up,"Fri Aug 06, 2021 5:45 am",5,1077,World Football,Leo Messi to sign for Tottenham
"ref ad that was only Neymar. Essentially Argentina had 1 real chance and Di Maria took it brilliantly. A few penalty calls. So much emphasis on Messi. Evan after final whistle all the players ran to Messi. Certainly an ""I"" in that team. Pity the Aussies weren't there :grin: Finally messi delivers","Wed Jul 14, 2021 12:13 pm",6,3099,"Australian National Football Teams - Socceroos, Olyroos, Matildas  etc",Copa America 2020 on Optus Sport
"ref ad that was only Neymar. Essentially Argentina had 1 real chance and Di Maria took it brilliantly. A few penalty calls. So much emphasis on Messi. Evan after final whistle all the players ran to Messi. Certainly an ""I"" in that team. Pity the Aussies weren't there :grin:","Sun Jul 11, 2021 11:36 am",6,3099,"Australian National Football Teams - Socceroos, Olyroos, Matildas  etc",Copa America 2020 on Optus Sport
"relatively comfortably, why did he change that winning formula? He's naturally a cautious coach who takes no risks. If he had a 25 year old Lionel Messi in his squad, he'd be sat on the bench because he doesn't fit the square peg holes that Gareth loves. I think he going to play for penalties and","Tue Jul 06, 2021 8:15 am",469,34324,World Football,Euro 2020
"Yes , our best ever player. I can’t see many scousers agreeing with you if an overweight Messi did nothing in one guest appearance for LFC. There is no way they would they put him a ahead of Gerrard or Dalglish as “ LFC best ever” . Well, you can’t have guest appearances","Sun May 09, 2021 9:03 am",27,2951,World Football,Happy Birthday to WA's best ever
"Well, you can’t have guest appearances in proper leagues.","Sat May 08, 2021 10:21 pm",27,2951,World Football,Happy Birthday to WA's best ever
I can’t see many scousers agreeing with you if an overweight Messi did nothing in one guest appearance for LFC. There is no way they would they put him a ahead of Gerrard or Dalglish as “ LFC best ever” .,"Sat May 08, 2021 9:59 pm",27,2951,World Football,Happy Birthday to WA's best ever
"Souness and best are not that good. Strewth Never said that . George Best player I have seen live but that was it his peak . So if a 40 year old Messi played one guest appearance for Liverpool would you put him ahead of all the legends like Dalglish, Rush , Keegan etc as Liverpool’s greatest","Sat May 08, 2021 5:43 pm",27,2951,World Football,Happy Birthday to WA's best ever
So galekovic was a better player then Romario? Mmmmm Your confusing what Romario did away from AU with what he did at AU. By your logic if Messi at age 40 played 5 games for Liverpool way past his best he would be ranked above Dalglish as LFC greatest player. Romario better player over his,"Thu May 06, 2021 11:05 pm",27,2951,World Football,Happy Birthday to WA's best ever
"video which is all 100 of his EPL goals, half an hour in I was asking the same question, why does no one mark him, now watch Ronaldo, watch Messi & you end up asking the same questions, good players get away from defenders and make themselves space, the difference between themselves & average","Mon Sep 07, 2020 7:39 am",11,2995,Womens Football,Season review to date
"Barcelona v. Bayern 2-8(!). Barca absolutely slaughtered. When, if ever, was the last time Messi was on a losing side by that margin? Pique now officially past it - a mere statue in the Barca defence. The Bayern forwards and midfielders simply walked past him. Coutinho","Sat Aug 15, 2020 1:11 pm",68,11362,World Football,Champions League 19/20
You can do it whenever. it is more or less unimportant. It was a great encouragement.,"Thu Apr 02, 2020 1:39 am",4,1870,World Football,"Messi, C. Ronaldo donated 1 million euros against Covid-19"
"wish I was in a position to do that. don't knock them,they didn't have to","Thu Apr 02, 2020 1:32 am",4,1870,World Football,"Messi, C. Ronaldo donated 1 million euros against Covid-19"
Yes. Right!,"Tue Mar 31, 2020 9:35 pm",4,1870,World Football,"Messi, C. Ronaldo donated 1 million euros against Covid-19"
so a weeks wages well done,"Mon Mar 30, 2020 1:47 pm",4,1870,World Football,"Messi, C. Ronaldo donated 1 million euros against Covid-19"
"Messi, C.Ronaldo and Guardiola have just made a donation of 1 million euros to fight the Covid-19 pandemic that is booming in Europe and many other parts of the world. View details on page: ","Sat Mar 28, 2020 1:22 pm",4,1870,World Football,"Messi, C. Ronaldo donated 1 million euros against Covid-19"
"Wow Inter lost at home,even with no Messi.","Wed Dec 11, 2019 2:56 pm",68,11362,World Football,Champions League 19/20
"The fact that Ronaldo has won trophies in many other leagues suggests that he is a better player.but according to Klopp, Van Dijk was robbed!","Fri Dec 06, 2019 11:29 am",2,1026,World Football,Messi now has one more Ballon d'Or than Ronaldo
"messi maybe better than ronaldo but it must be said ronaldo has at least conquered epl , la liga and serie a","Thu Dec 05, 2019 11:27 am",2,1026,World Football,Messi now has one more Ballon d'Or than Ronaldo
"In 2009, more specifically on December 1, Leo Messi lifted his first Golden Ball after winning all possible titles with FC Barcelona. A season that appealed to the Barça team to be named one of the best of all time and to Argentina the future of","Wed Dec 04, 2019 7:03 pm",2,1026,World Football,Messi now has one more Ballon d'Or than Ronaldo
19. Improved his heading power & shooting power to add to his sometime show-pony step-overs. Always looking to create space for himself. Shades Messi as the current best modern-day player IMO.,"Tue Oct 15, 2019 10:49 am",104,14943,World Football,Euro 2020
O dearAre you sure? You have been through every player in the world to know that?,"Tue Jul 02, 2019 4:59 pm",8,2151,World Football,Thiago Silva labelled Lionel Messi the GOAT
Their is no such player called Christian Ronaldo,"Tue Jul 02, 2019 4:00 pm",8,2151,World Football,Thiago Silva labelled Lionel Messi the GOAT
Christian Ronaldo is not even the best ever player called Ronaldo. Messi is not even the best ever player from the Falklands war runner ups.,"Tue Jul 02, 2019 10:48 am",8,2151,World Football,Thiago Silva labelled Lionel Messi the GOAT
"Thiago Silva labelled Lionel Messi the greatest player of all-time ahead of Brazil's Copa America semi-final showdown against Argentina. Messi has been criticised after a quieter Copa America campaign, although Argentina are into the last","Mon Jul 01, 2019 12:03 pm",8,2151,World Football,Thiago Silva labelled Lionel Messi the GOAT
Was Djimi Traore better than Luis Suarez?,"Mon Jul 01, 2019 12:00 pm",8,2151,World Football,Thiago Silva labelled Lionel Messi the GOAT
"Ronaldo >> MessiLook at what they have won for their country, Ronaldo won a Euro Title with an average Portugal, Messi has won nothing with a good Argentina.","Mon Jul 01, 2019 9:23 am",8,2151,World Football,Thiago Silva labelled Lionel Messi the GOAT
"YOU'LL NEVER WALK ALONE!! :D :D :D :D :D :D :D :D :D :D Congrats on a great performance, especially with Firmino and Salah missing. If Messi doesn't really perform I think Barca are way past their best, but Liverpool were comfortably the better side over the two legs. Hoping for an EPL final.","Fri May 10, 2019 9:11 am",207,33619,World Football,Champions League 2018/19
"worlds greatest ever CB played this morning????? :lol: :lol: :lol: That was some game and Liverpool didn't deserve to lose 3-0, but what player Messi is, everything going forward was through him or scored by him and a sublime free kick to cap it all. I didn't think VVD did much wrong, first","Thu May 02, 2019 9:17 am",207,33619,World Football,Champions League 2018/19
De Gea best keeper in the World according to Utd fans. Lionel Messi certainly loves him,"Wed Apr 17, 2019 4:52 am",1062,202417,World Football,Man Utd
"It won (joint?) horse of the year, a world-wide recognition, so it's like coming equal with Messi in football terms. Race overseas and it wont be joint winner. Yeah, probably be outright winner. If it were my horse, I wouldn't risk a long trip either. Didn't do Black","Mon Apr 15, 2019 3:16 pm",16,6395,Other Sports,Winx
Race overseas and it wont be joint winner.,"Mon Apr 15, 2019 12:38 pm",16,6395,Other Sports,Winx
"Its like being a good footballer in the A League. It won (joint?) horse of the year, a world-wide recognition, so it's like coming equal with Messi in football terms.","Mon Apr 15, 2019 11:14 am",16,6395,Other Sports,Winx
"Another hatty overnight. A free kick that he placed so well that even with the keeper on that side he couldn’t stop it and a third goal that was simply brilliant. To have the presence of mind to even consider chipping the keeper from there was impressive, to have the touch and skill to pull it off w","Mon Mar 18, 2019 11:13 am",3,1658,World Football,Lionel Messi scored his 400th La Liga goal
The 'one shot' penalty rule may be stupid but it will get rid of the need for officials to try and control the currently out of hand encroachment that happensand prevent the Cryuff-Messi style layoff penalty farce,"Sat Mar 02, 2019 6:03 pm",14,3991,World Football,Laws-of-the-Game Board (IFAB) 2 March 2019 AGM @ Aberdeen
"Just how good is this guy. Lionel Messi scored his 50th career hat-trick as he inspired Barcelona's comeback to beat Sevilla 4-2. Barca went 10 points clear at the top of the La Liga table thanks to their star man, who scored three goals of","Sun Feb 24, 2019 1:04 pm",3,1658,World Football,Lionel Messi scored his 400th La Liga goal
Unbelievable feat by King Messi. We'll never see a player like that ever again. I hope I'm wrong though.,"Wed Jan 23, 2019 12:56 am",3,1658,World Football,Lionel Messi scored his 400th La Liga goal
"As Barcelona beat Eibar at the Nou Camp to regain their five-point lead at the top of the table.Messi, the all-time leading scorer in the Spanish top flight, finished into the bottom corner for Barca’s second. The landmark goal comes in the Argentine’s 435th league game. Read More","Mon Jan 14, 2019 2:31 pm",3,1658,World Football,Lionel Messi scored his 400th La Liga goal
"The move shocked the Spanish champions, with Gerard Pique claiming Neymar would be staying at the Nou Camp just before the move was completed. Messi told：""I think it is complicated how Neymar would leave PSG. We would love to have him back, as a player and for the dressing room. We're friends,","Thu Jan 03, 2019 12:07 pm",2,1445,World Football,Transfer rumors
"season 2018/2019 I am a big fan of barca for 20 years now. Their style of play this season is great, barca will win this year's league and Messi will win the pichichi. Look at real madrid and atletico madrid, they are too weak this season, they are hard to fight with barca. ","Thu Dec 20, 2018 12:38 pm",0,1003,World Football,barcelona 2018/2019
"Why would any A-League keeper go to a lower league? Also, its like asking someone to prove why Messi isn't good enough for the Indian Premier League as he hasn't actually played there, its not possible to ""prove"" but its obvious to anyone with half a brain that he wouldn't","Mon Sep 24, 2018 3:11 pm",73,11320,World Football,Goalkeeper Wanted
"be good enough in the future, but they're not now. Why would any A-League keeper go to a lower league? Also, its like asking someone to prove why Messi isn't good enough for the Indian Premier League as he hasn't actually played there, its not possible to ""prove"" but its obvious to anyone with","Mon Sep 24, 2018 10:11 am",73,11320,World Football,Goalkeeper Wanted
"the social pressures. whatever happened to working hard to achieve things? Just like happened to Wayne Rooney, Michael Owen, Ronaldo and Lionel Messi - total failures every one. :wink:","Tue Jul 17, 2018 12:38 pm",32,7009,World Football,Arzani
"goals. Unlucky a couple of times last night. I am not looking forward to loosing Hazard, a genius with the ball. At this WC so much better than Messi skillwise. I still regret Kevin De Bruyne leaving Chelsea. Mourinho did not give him a chance plus had to battle a massive midfield at the time","Sun Jul 15, 2018 12:02 pm",614,82121,World Football,World Cup 2018
GTC and SV still celebrating at the Croatian club? :wink: Nice win and wonder if Messi will quit the Argie national team again if they fail to get to next round. :lol: :lol: :lol: :lol: :lol: 8) 8) 8) 8) 8) How were bar sales? 8) Made enough to sign Ante Rebic for,"Fri Jun 22, 2018 12:56 pm",614,82121,World Football,World Cup 2018
How were bar sales?,"Fri Jun 22, 2018 10:46 am",614,82121,World Football,World Cup 2018
,"Fri Jun 22, 2018 10:37 am",614,82121,World Football,World Cup 2018
GTC and SV still celebrating at the Croatian club? :wink: Nice win and wonder if Messi will quit the Argie national team again if they fail to get to next round.,"Fri Jun 22, 2018 9:18 am",614,82121,World Football,World Cup 2018
I'm in the Messi camp regarding the BITW player but Ronaldo may have just overtaken him in my estimation. Hattrick and has scored at 4 WC's. Just absolutely brilliant. I watched the earlier game Uruguay vs Egypt. Great game and,"Sat Jun 16, 2018 10:10 am",614,82121,World Football,World Cup 2018
I'm in the Messi camp regarding the BITW player but Ronaldo may have just overtaken him in my estimation. Hattrick and has scored at 4 WC's. Just absolutely brilliant. I watched the earlier game Uruguay vs Egypt. Great game and pity Egypt lost at the end. To see Salah sitting on bench was shame.,"Sat Jun 16, 2018 8:54 am",614,82121,World Football,World Cup 2018
"Pavon (Boca Juniors), Maximiliano Meza (Independiente), Ricardo Centurion (Racing), Rodrigo Battaglia (Sporting Lisbon/POR). Forwards: Lionel Messi (Barcelona/ESP), Gonzalo Higuain and Paulo Dybala (Juventus/ITA), Mauro Icardi (Inter Milan/ITA), Sergio Aguero (Manchester City/ENG), Diego Perotti","Wed May 16, 2018 11:13 am",0,899,World Football,Argentina squad 2018
"Salah is now up there with Messi, Ronaldo etc, no doubt. :lol: :lol: You're kidding right? Salah has had an amazing season. Definately deserves all the plaudits he's getting. Great player. But Messi and Ronaldo have been having these kind","Thu Apr 26, 2018 2:11 pm",1717,285118,World Football,Liverpool
"Whilst Ronaldo has done well playing in the EPL, has Messi? You claim EPL to be the hardest league in the world right? Salah is tearing up EPL and UCL.","Thu Apr 26, 2018 9:06 am",1717,285118,World Football,Liverpool
"Salah is now up there with Messi, Ronaldo etc, no doubt. :lol: Agree, he is above everyone at present :wink: Another 5 goals, shame we don’t have Phil though, could have done with him v Stoke on Saturday. With injuries to Can, Lallana","Wed Apr 25, 2018 9:37 am",1717,285118,World Football,Liverpool
"to see a side's crowd celebrating a 5-2 loss, but I guess away goals have been kind to Roma this campaign. :wink: Salah is now up there with Messi, Ronaldo etc, no doubt. Just need level heads going to Rome.","Wed Apr 25, 2018 7:57 am",1717,285118,World Football,Liverpool
"Keep up, my method!! Jurgen buys the likes of Salah and Mane, 2nd tier","Mon Jan 01, 2018 1:48 pm",60,15798,World Football,EPL Transfers 2018
The Jurgen Klopp method of coaching eh? Sounds like he's copying Pep :wink:,"Mon Jan 01, 2018 12:49 pm",60,15798,World Football,EPL Transfers 2018
"give my age? Sounds a bit plastic in his ideas as well then Jan 1st 2018 and I am being called plastic - love it! The year can only get better. Messi, Ronaldo KDB. SIgn them and we are better - this is easy.","Mon Jan 01, 2018 11:52 am",60,15798,World Football,EPL Transfers 2018
And you think these players and coaches are getting paid good money.,"Wed Oct 11, 2017 12:01 pm",35,8411,World Football,WC Qualifiers - South America
"Everything I hate about modern defending right there. Under pressure so put the bottle of shiraz ball in the stands and, if Messi comes to challenge, stick him there with it. Yep not stuffing around with the ball in your final third - Good defending - players body shape, positioning,","Wed Oct 11, 2017 11:58 am",35,8411,World Football,WC Qualifiers - South America
"[. Everything I hate about modern defending right there. Under pressure so put the bottle of shiraz ball in the stands and, if Messi comes to challenge, stick him there with it.[/quote] Yep not stuffing around with the ball in your final third - Good defending - players body shape, positioning,","Wed Oct 11, 2017 11:18 am",35,8411,World Football,WC Qualifiers - South America
"1-1 now Argentina equalizer after 14 minutes all other games 0-0 atm Messi is soooo one footed it's unbelievable. Good goal though. Argentina now 2-1 up. Everything I hate about modern defending right there. On the edge of your own box and under pressure,","Wed Oct 11, 2017 11:07 am",35,8411,World Football,WC Qualifiers - South America
all half time scores - coffee time,"Wed Oct 11, 2017 10:51 am",35,8411,World Football,WC Qualifiers - South America
Update,"Wed Oct 11, 2017 10:43 am",35,8411,World Football,WC Qualifiers - South America
Ecuador 1 V Argentina (Messi 2) 2 Uraguay 0 V Bolivia 1all the others are 0-0 atm - 28 minute mark,"Wed Oct 11, 2017 10:28 am",35,8411,World Football,WC Qualifiers - South America
Argentina now 2-1 up.,"Wed Oct 11, 2017 10:21 am",35,8411,World Football,WC Qualifiers - South America
Messi is soooo one footed it's unbelievable. Good goal though.,"Wed Oct 11, 2017 10:16 am",35,8411,World Football,WC Qualifiers - South America
"when you haven't heard people I consider to be better? That's like watching me play football and saying I'm the best in the world without watching Messi play. Benaud was a good presenter, not a good commentator and a prick of a person. I don't understand what perfext means. You are not a good player","Fri Aug 25, 2017 2:14 pm",15,5813,Other Sports,Test Cricket to move to Foxtel from FTA?
"when you haven't heard people I consider to be better? That's like watching me play football and saying I'm the best in the world without watching Messi play. Benaud was a good presenter, not a good commentator and a prick of a person.","Fri Aug 25, 2017 1:46 pm",15,5813,Other Sports,Test Cricket to move to Foxtel from FTA?
believe he will go to Germany or England( that's because they have money and can afford it) Wouldn't it be funny if he went to Barca to play with Messi?,"Fri Jul 07, 2017 2:31 pm",5,2311,World Football,Ronaldo to leave Real Madrid?
"a sore point it was bought to my attention by an English rag.. such a bad loser..even Real Madrid fans have stood and clapped a Messi master class. 'greasy knuckle dragger'..really showing your insecurities there. Sore point? Seeing as you got the date wrong, we didn't","Sun Jun 25, 2017 7:26 pm",116,23046,World Football,Happy Anniversary England!!!!!!
ohhhhhh..such a sore pointit was bought to my attention by an English rag..such a bad loser..even Real Madrid fans have stood and clapped a Messi master class.'greasy knuckle dragger'..really showing your insecurities there.,"Sun Jun 25, 2017 7:24 pm",116,23046,World Football,Happy Anniversary England!!!!!!
"but if we are serious about protecting the safety of players and sending out a strong message, IMO it should be a 3 game suspension. I believe Messi got a 4 game ban for insulting an official which could be seen by many as being heavy handed compared to Naylor's punishment. 3 games should be","Sun Apr 09, 2017 2:28 pm",39,10862,World Football,LEG BREAKING TACKLE
