"'Lionel Messi is a cretin & he disgraced himself at the Copa America' – Napoli owner blasts Barcelona & Argentina star Aurelio De Laurentiis suggests the forward should not play for ""idiots"" who do not know how to get the best","Sun Jul 24, 2011 10:22 am",10,1264,World Football,Messi is a cretin Napoli owner blasts Messi & Argentina
"off the substitutes' bench. He has made a total of 42 league starts in the past four seasons, and scored 26 goals, but found himself behind Lionel Messi, David Villa and Pedro in the Camp Nou hierarchy of forwards. Krkic picked up a host of medals as Barcelona dominated the domestic and European","Sat Jul 23, 2011 11:52 am",53,4773,World Football,summer 2011 transfer thread
"Park at -5 degrees in heavy hail, or Iggies pitch in the wet after 6 games have been played on it. But Allstars pitch is really bad on a good day. Messi couldn't play a good pass on that pitch! It's impossible to pass the ball along the ground. acu, I don't mean to offend if you actually have to","Wed Jul 20, 2011 7:18 pm",58,9418,Amateur League,Best Pitch in Amateur Leagues
"got the below from a pretty reliable blog in the UK “Who Is Messi? Who Is Neymar? I Present To You: Joel Campbell” Published: 17th July 2011 After a number of impressive displays at this year’s Copa America, a number of media outlets claim that Arsenal","Mon Jul 18, 2011 7:52 am",740,72422,World Football,Arsenal 2011/12
"liverpool signing good players :lol: :lol: Henderson and Adam wont get you anywhere It's like talking to a 12 year old NAH LIVRPOOL DIDUNT BYE MESSI OR RONALDO, DEY MAYD CRAP TRANZFRS!!! your actually a bottle of shiraz tosser Henderson and Adam are not world class players you idiot. can u","Wed Jul 13, 2011 3:16 pm",118,8706,World Football,If Man United sign Sneijder.....
"It's like talking to a 12 year oldNAH LIVRPOOL DIDUNT BYE MESSI OR RONALDO, DEY MAYD CRAP TRANZFRS!!!","Wed Jul 13, 2011 1:20 pm",118,8706,World Football,If Man United sign Sneijder.....
"LOL @ Napoli Soccer fans in this thread. Delusional. Where did I say Messi would go to Napoli? I think eventually he will end up at inter or Milan. Teams like Lazio, Napoli et al these days have little or no chance competing with transfers of that magnitude","Tue Jul 05, 2011 9:01 pm",14,1709,World Football,Milan consider Marchisio bid
"a landmark on the map of Spanish youth development. Great players to pass through its doors include current Barcelona coach Pep Guardiola, Lionel Messi and the latest batch of Spanish World Cup winners. Gerard Pique, Xavi, Andres Iniesta and a host of other Spanish squad members have developed","Tue Jul 05, 2011 4:28 pm",4,3265,Coaching Football,A culture change is required...
"do you people not know the story behind messi and barcelona? they payed for expensive treatment because he had a growth deficiency, took him into the barca youth ranks and gave his dad a job, and because of this he has said and its just common","Mon Jul 04, 2011 4:48 pm",14,1709,World Football,Milan consider Marchisio bid
First I've ever heard of that.,"Mon Jul 04, 2011 4:22 pm",14,1709,World Football,Milan consider Marchisio bid
"maradona didn't really like spain, it was in NAPOLI where he belonged..hopefully one day Messi will follow in the great mans footsteps","Mon Jul 04, 2011 4:13 pm",14,1709,World Football,Milan consider Marchisio bid
"thats what was said about the MASTER, El Diego Maradona!!","Mon Jul 04, 2011 2:18 pm",14,1709,World Football,Milan consider Marchisio bid
he will never NEVER EVER leave barca,"Mon Jul 04, 2011 10:54 am",14,1709,World Football,Milan consider Marchisio bid
"faaark me, 100Million Euro for hamsik?Sell him and get Messi and Aguero!","Mon Jul 04, 2011 9:48 am",14,1709,World Football,Milan consider Marchisio bid
"As good as Messi is, this guy was always more entertaining in my eyes. Another example of someone who was unplayable on his day.  Ronaldinho at his best was the best footballer","Fri Jul 01, 2011 2:45 pm",8,453,World Football,Could watch them all day.
"As good as Messi is, this guy was always more entertaining in my eyes. Another example of someone who was unplayable on his day.  re=related","Fri Jul 01, 2011 9:00 am",8,453,World Football,Could watch them all day.
" For every Messi and Muller, there is a Ronaldo and Owen - how football’s youth movement is jeopardising the next generation of stars A Goal.com","Thu Jun 30, 2011 1:43 pm",6,406,World Football,Footballs addiction on youth overloading some players
"and especially the raw recruits to the side like 16 year old Caitlin Foord who shone at right back, tackling Brazil's Marta, hailed as a female Messi. ""Fantastic,"" he said. You're up against one of the tournament players, the best player in the world, and I think for long periods of the game,","Thu Jun 30, 2011 9:19 am",18,4479,Womens Football,FIFA Women’s World Cup 2011.
"greatest midfielder, but then again if we narrow it down to attacking midfielders, I certainly think players like Zidane, Platini and Hoddle (and Messi in a few years) have a shot at the perch. Having many Juve friends, many of them will say to me that Platini was on par with Maradona, and I think","Tue Jun 28, 2011 2:01 pm",142,13181,World Football,Pele's at it again.
"is half the 2003 a team which won promotion to div 1!!! and since when does weight matter in soccer just look at two of the best ever maradona and messi probably weighed 90 kg together, by the way I believe it was the cougars c coach who had the crack about hawks warm up ..the truth is the guys","Sun Jun 26, 2011 3:08 pm",404,58539,Amateur League,Ofiicial Sat Div 7 (C's) thread
"the worl playing crap sides tomake money. you're thinking of ronaldo , not the greatest player to play the game. Clearly, there is no doubt that messi isn't in the same class as pele - YET! dont you mean romario mate ??????????????? ronaldo never counted his goals like that Both Pele and Romario's","Sat Jun 25, 2011 11:10 am",142,13181,World Football,Pele's at it again.
"credit is due. And you forgot to add a couple of nations that have produced some out standing players.(Spain , Italy )[/quote] I am not knocking messi either, just saying that a bloke who's only been playing for 5 minutes cannot be compared with someone like pele. Not yet anyway. I cannot think","Fri Jun 24, 2011 8:53 pm",142,13181,World Football,Pele's at it again.
"the worl playing crap sides tomake money. you're thinking of ronaldo , not the greatest player to play the game. Clearly, there is no doubt that messi isn't in the same class as pele - YET! dont you mean romario mate ??????????????? ronaldo never counted his goals like that","Fri Jun 24, 2011 6:13 pm",142,13181,World Football,Pele's at it again.
"I don't think I have ever seen a better player (skill wise) than Messi. But as you say Hawkesy, he needs to be around longer to become the world's best ever.Quantity not just quality make them legends, and he a few years to go yet to be up with Pele and Neil Harris.","Fri Jun 24, 2011 5:35 pm",142,13181,World Football,Pele's at it again.
"when England produce a player equal or better than Messi or Maradona then you guys can talk, for now the best thing you guys can do is sit back and watch and marvel at the genius that is Messi. Just like the rest of the world. in that case shouldn't","Fri Jun 24, 2011 4:52 pm",142,13181,World Football,Pele's at it again.
Did I say better? How about equal?,"Fri Jun 24, 2011 4:47 pm",142,13181,World Football,Pele's at it again.
Still looking for a source where Messi says he is better than Pele?,"Fri Jun 24, 2011 4:30 pm",142,13181,World Football,Pele's at it again.
Have you seen Hoddle play?,"Fri Jun 24, 2011 1:58 pm",142,13181,World Football,Pele's at it again.
Dream on,"Fri Jun 24, 2011 1:50 pm",142,13181,World Football,Pele's at it again.
Hoddle?,"Fri Jun 24, 2011 1:40 pm",142,13181,World Football,Pele's at it again.
"when England produce a player equal or better than Messi or Maradona then you guys can talk, for now the best thing you guys can do is sit back and watch and marvel at the genius that is Messi. Just like the rest of the world.","Fri Jun 24, 2011 1:31 pm",142,13181,World Football,Pele's at it again.
"Que Maradona having a moan. He will go into bat for Messi. Glad Messi says nothing, he leaves it to his feet. He'll go in to bat for anyone against pele, because he has an inferiority complex about the man. Don't blame him really, he isn't the best","Fri Jun 24, 2011 12:56 pm",142,13181,World Football,Pele's at it again.
"the worl playing crap sides tomake money. you're thinking of ronaldo, not the greatest player to play the game. Clearly, there is no doubt that messi isn't in the same class as pele - YET! In achievements you have a point, but Messi amazes all. When messi has been on the stage more than 5 minutes","Fri Jun 24, 2011 12:55 pm",142,13181,World Football,Pele's at it again.
"the worl playing crap sides tomake money. you're thinking of ronaldo, not the greatest player to play the game. Clearly, there is no doubt that messi isn't in the same class as pele - YET! In achievements you have a point, but Messi amazes all.","Fri Jun 24, 2011 12:53 pm",142,13181,World Football,Pele's at it again.
He will. Because he is an Argie and a CHEAT!,"Fri Jun 24, 2011 12:53 pm",142,13181,World Football,Pele's at it again.
"you're thinking of ronaldo, not the greatest player to play the game. Clearly, there is no doubt that messi isn't in the same class as pele - YET!","Fri Jun 24, 2011 12:52 pm",142,13181,World Football,Pele's at it again.
"He will go into bat for Messi. Glad Messi says nothing, he leaves it to his feet.","Fri Jun 24, 2011 12:51 pm",142,13181,World Football,Pele's at it again.
Lionel Messi needs to score 1283 goals to be better than me - Brazil legend Pele Outspoken Santos great believes Barcelona dynamo needs to score more goals than he did if he is to be considered the best Find the best odds and,"Fri Jun 24, 2011 12:14 pm",142,13181,World Football,Pele's at it again.
"""Messi is an exceptional player and I doubt anyone can separate him [from being the best].""﻿[/quote] I think you missed the point of the whole article Baggio??? The real story here is, the greatest football player to ever","Wed Jun 22, 2011 8:22 pm",114,9718,World Football,Maradona
Lionel Messi,"Wed Jun 22, 2011 7:23 pm",32,6281,Amateur League,"best opposition player you""ve seen so far?"
"Argentina legend Diego Maradona: Neymar is bad-mannered just like Pele Former World Cup winner has defended Lionel Messi from criticism, slamming both the Brazilian international and the legendary Santos forward - a long-time rival of the Argentine Find the best odds and bet on","Wed Jun 22, 2011 5:51 pm",114,9718,World Football,Maradona
and Messi,"Fri Jun 17, 2011 4:42 pm",17,2335,World Football,BREAKING NEWS
"Heskey > Parker > Modric > Messi. Not just captain yids, King.","Thu Jun 16, 2011 5:17 pm",58,5560,World Football,Man U TV - Had to Laugh
I would like to stay for this quality discussion. Dirk Kuyt > Messi,"Wed Jun 15, 2011 2:37 pm",178,15585,World Football,Manchester United 2011/12
Ctrl CCtrl V,"Tue Jun 14, 2011 11:09 am",178,15585,World Football,Manchester United 2011/12
I'd rather have Harry Kewell back at Liverpool than Messi because Kewell is premier league proven. You've just shot any credibility you ever had or will have mate. Andy Gray has even said Messi would struggle. Kewell has scored 68 goals against English,"Tue Jun 14, 2011 10:55 am",178,15585,World Football,Manchester United 2011/12
I'd rather have Harry Kewell back at Liverpool than Messi because Kewell is premier league proven. You've just shot any credibility you ever had or will have mate. I'm pretty sure he was just mirroring Manu4life's comment above. IE: he'd rather Parker,"Tue Jun 14, 2011 10:55 am",178,15585,World Football,Manchester United 2011/12
You've just shot any credibility you ever had or will have mate.,"Tue Jun 14, 2011 10:46 am",178,15585,World Football,Manchester United 2011/12
"I'd prefer Jarvis over Bale. Jarvis has the talent, though Bale does have a financial upside. I feel Jarvis is a stud. I'd rather have Harry Kewell back at Liverpool than Messi because Kewell is premier league proven.@Der_Tiser: pure brilliance.","Tue Jun 14, 2011 10:25 am",178,15585,World Football,Manchester United 2011/12
Messi is overrated. Cuts in onto his left foot too much.,"Tue Jun 14, 2011 12:42 am",178,15585,World Football,Manchester United 2011/12
"have had many opportunities but said nothing.” Many opportunities? That’s about as funny as saying Rio had many opportunities to tackle Lionel Messi in the Champions League Final. Anyway, the next day, after the England-Switzerland game at Wembley, I said it when I saw him. It wasn’t easy.","Wed Jun 08, 2011 11:52 am",30,2749,World Football,Rio Ferdinand - an angry young man
"Football:  And then, before you know it, the match is underway. I'm watching Leo Messi, Xavi, Iniesta and co. against Rooney, Giggs, and a bloke who wears his nickname on his shirt. It's engrossing. It's incredible. It's… surprisingly","Fri Jun 03, 2011 10:08 am",1,322,World Football,One Night at Wembley
"a dozen times. And before you try to drag this thread off on some obscure tangent, I have seen Best, Law, Charlton, Cantona, Pele, Maradonna, Messi, Cruyff, Beckenbauer as well, either live or recorded footage, and I could tell that all of them could play a bit too. Thread closed. Of all of","Wed Jun 01, 2011 2:57 pm",23,1546,World Football,United kids win tenth FA Youth Cup
"a dozen times. And before you try to drag this thread off on some obscure tangent, I have seen Best, Law, Charlton, Cantona, Pele, Maradonna, Messi, Cruyff, Beckenbauer as well, either live or recorded footage, and I could tell that all of them could play a bit too. Thread closed.","Tue May 31, 2011 1:50 pm",23,1546,World Football,United kids win tenth FA Youth Cup
"Main story on BBC Sport, come a long way from a Lwr NE rd law firm, elected on an anti-gambling agenda.","Mon May 30, 2011 10:28 pm",29,2222,World Football,Xenophon...Jack Warner - World Headlines!
its getting messi.. d-cup-fifa -live-blog,"Mon May 30, 2011 9:44 pm",29,2222,World Football,Xenophon...Jack Warner - World Headlines!
"I agree, except Yaya in for Xabi ALonso","Mon May 30, 2011 1:24 pm",47,5367,World Football,European Best XI 2010-11 - Your pick?
"NeuerDani Alves, Thiago Silva, Vidic, MarceloXavi, Xabi Alonso, IniestaMessi, Cavani, Ronaldo","Mon May 30, 2011 10:24 am",47,5367,World Football,European Best XI 2010-11 - Your pick?
"and though Wayne Rooney pulled one back for the English champions before the first half was out United were like mere playthings for Barca. Lionel Messi, arguably the best player in the world and a deserved man of the match, produced a scintillating finish to restore Barca's lead in the 54th minute,","Sun May 29, 2011 7:15 pm",125,10313,World Football,Man Utd v Barcelona - The Final
"when played well, looks unstoppable. Agree about Giggsy but Carrick was also rubbish, continually went missing in front of the back four. No way Messi would have got that much room with Roy Keane playing.","Sun May 29, 2011 11:10 am",125,10313,World Football,Man Utd v Barcelona - The Final
"And I'm sure we won't make a Barcelona team or a 'Messi' here in Aust, but faaark me it's ALOT better to watch kids trying to play like that ..","Sun May 29, 2011 7:31 am",16,1580,World Football,However hard it is for me
------------------Casillas------------------------Dani Alves-----Vidic---------Pique--------Marcelo------------------YaYa Toure-------------Xavi-------Van der Vart-----------Messi-----------Chicarito-----------Ronaldo-----,"Fri May 27, 2011 8:24 pm",47,5367,World Football,European Best XI 2010-11 - Your pick?
If I was picking the team I'd bring in John O'Shea at the expense of Vidic. You need someone quick and nimble in there to do a job on Messi. :lol: :lol: :lol: :lol: :lol: :lol: :lol: :lol: :lol: :lol: :oops: :oops: :oops: :oops: :oops: :oops: :oops: :oops: :oops: :oops: :oops: :clown: :clown:,"Fri May 27, 2011 5:47 pm",125,10313,World Football,Man Utd v Barcelona - The Final
If I was picking the team I'd bring in John O'Shea at the expense of Vidic. You need someone quick and nimble in there to do a job on Messi.,"Fri May 27, 2011 4:56 pm",125,10313,World Football,Man Utd v Barcelona - The Final
"will flood into London from all corners of the globe, to see if Ferguson’s latest team can overcome the ball-players of Barcelona, led by Lionel Messi, the dazzling inside forward from Argentina. Most neutrals may well hope they cannot. Over the years the irascible Jock, who seems to live in","Fri May 27, 2011 2:56 pm",47,3125,World Football,Ferguson Article - FAO JimBob
i did mention this,"Fri May 27, 2011 2:20 pm",125,10313,World Football,Man Utd v Barcelona - The Final
"I don't know where these United boys are getting the idea that Park can help track Messi from.Unless you play him at centre half, Park will barely go anywhere near him.","Fri May 27, 2011 2:01 pm",125,10313,World Football,Man Utd v Barcelona - The Final
"football in its premium. Man Utds game plan will not necessarily change too much. The inclusion of Park is a must for me, he will take care of Messi's run, imo. I feel that Barca have a real presence at Camp Nou, but away from there they try to really grind teams down. But bear in mid Barca","Fri May 27, 2011 12:08 pm",125,10313,World Football,Man Utd v Barcelona - The Final
"football in its premium. Man Utds game plan will not necessarily change too much. The inclusion of Park is a must for me, he will take care of Messi's run, imo. I feel that Barca have a real presence at Camp Nou, but away from there they try to really grind teams down. how, park is a wide player","Fri May 27, 2011 10:50 am",125,10313,World Football,Man Utd v Barcelona - The Final
"football in its premium. Man Utds game plan will not necessarily change too much. The inclusion of Park is a must for me, he will take care of Messi's run, imo. I feel that Barca have a real presence at Camp Nou, but away from there they try to really grind teams down.","Fri May 27, 2011 10:45 am",125,10313,World Football,Man Utd v Barcelona - The Final
"if united get sidetracked just keeping messi quiet it leaves the door open for iniesta or xavi to put their own stamp on the match, united need to just play their own game and just close messi when he gets the ball","Thu May 26, 2011 1:44 pm",125,10313,World Football,Man Utd v Barcelona - The Final
"The thing is you have to keep Messi quiet, if he is on form Barca will win. Rooney and others can do bits of brilliance but often they rely on a good pass/cross etc, Messi can (and does) do it himself, Scholes could easily get sent off trying to stop him.","Thu May 26, 2011 1:35 pm",125,10313,World Football,Man Utd v Barcelona - The Final
Dani Alves-----Vidic-----Thiago Silva-----Marcelo -------Sahin-------Ozil-------Yaya Toure------- ----Hulk-----------Messi-----------Ronaldo----- Honourable Mentions: Chicarito Cavani Di Natale Sanchez Hummels Boateng Ibrahimovic Falcao Xavi Raul Gomez Robben Eto Rolando,"Thu May 26, 2011 1:21 pm",47,5367,World Football,European Best XI 2010-11 - Your pick?
-----Hummels-----Thiago Silva------Vidic------ -----Yaya Toure-----Sahin-----Hernanes------ -------------Messi-----------Ronaldo---------- --------------------Cavani-------------------- Honourable mentions: Pique Luiz Rolando Xavi Hamsik Malouda Sanchez,"Thu May 26, 2011 11:16 am",47,5367,World Football,European Best XI 2010-11 - Your pick?
Ozil ------------------------ ---------- Ibrahimovic ------ Falcao ------------- Bench: Van De Sar Pepe Zapata Giggs Xabi Alonso Rooney Di Natale Messi got excluded due not being able to play in any system other than that of Guardiola. Kill yourself.,"Thu May 26, 2011 9:42 am",47,5367,World Football,European Best XI 2010-11 - Your pick?
Ozil ------------------------ ---------- Ibrahimovic ------ Falcao ------------- Bench: Van De Sar Pepe Zapata Giggs Xabi Alonso Rooney Di Natale Messi got excluded due not being able to play in any system other than that of Guardiola.,"Thu May 26, 2011 8:45 am",47,5367,World Football,European Best XI 2010-11 - Your pick?
Valdez (Barcelona) D: Gerard Pique (Barcelona) D: Taye Taiwo (Marseille) M: Arjen Robben (Bayern Munich) M: Frank Lampard (Chelsea) F: Lionel Messi (Barcelona) F: Hulk (Porto) Simple.,"Thu May 26, 2011 8:23 am",47,5367,World Football,European Best XI 2010-11 - Your pick?
a STAR player wanted to join a club (a winning club lots of titles etc and dominant team) (or was asked) and that player can win you a game (viz L.Messi or CR7) would the club grab him and say to the players try and compete with him and the spot is yours if you win it? Would they seriously give,"Wed May 25, 2011 2:45 pm",70,11597,Womens Football,Results 22nd May
"Adam didn't impress until he was 25. You guys have to stop being so critical of players at a young age, Not everyone is a Rooney, Ronaldo or Messi charlie adam did impress when he was young and in the huns first team set up, i remember epl teams were looking at him, then the hun genes","Wed May 25, 2011 9:53 am",34,2620,World Football,Ranieri to QPR?
"Adam didn't impress until he was 25. You guys have to stop being so critical of players at a young age, Not everyone is a Rooney, Ronaldo or Messi","Wed May 25, 2011 9:34 am",34,2620,World Football,Ranieri to QPR?
"Barca to win easily - 3-0. Messi hat-trick Your predicting Messi to score (his first goals in CL football on English soil), in the final????? I think Man Utd will do as Arsenal did/try, but execute it better. Cut off Messi's supply and","Tue May 24, 2011 4:27 pm",125,10313,World Football,Man Utd v Barcelona - The Final
Barca to win easily - 3-0.Messi hat-trick,"Tue May 24, 2011 3:07 pm",125,10313,World Football,Man Utd v Barcelona - The Final
was playing for Wales instead of England. If he'd played for England he'd have been regarded as World Class rather than just Great. So your saying messi is jst great since he's done nothing in a world cup? Giggs has not been to a world cup. That's his point so are you saying he has not been world,"Sun May 15, 2011 6:32 pm",20,1314,World Football,Ryan Giggs.
Giggs has not been to a world cup. That's his point,"Sun May 15, 2011 1:14 pm",20,1314,World Football,Ryan Giggs.
So your saying messi is jst great since he's done nothing in a world cup?,"Sun May 15, 2011 12:44 pm",20,1314,World Football,Ryan Giggs.
"praise on Manchester United's Javier Hernandez, arguing that the Mexico striker could reach the same heights achieved by Argentine maestro Lionel Messi. The 22-year-old has been in fantastic form since moving from Chivas in 2010, scoring 20 times in 42 appearances, and Pele had kind words for","Thu May 12, 2011 11:47 pm",6,420,World Football,Pele
i dont think anyone will win the Cole v Benayoun argument,"Wed May 11, 2011 4:40 pm",1668,136316,World Football,Liverpool FC 2010/11
"Who brought in Joe ""Messi"" Cole?What a stinker of a signing, hes on decent cash as well.","Wed May 11, 2011 4:17 pm",1668,136316,World Football,Liverpool FC 2010/11
ronaldo the real ronaldo was better then both,"Mon May 09, 2011 3:55 pm",67,5899,World Football,Pele
"""What do you want me to say? He made his debut with a bloke.""","Mon May 09, 2011 11:25 am",67,5899,World Football,Pele
- Another great match from this asian man .. who say united buy him for the T-Shirt ?? Now I have more confidence that he might be able to stop Messi in CHAMPION LEAGUE final :D :D,"Mon May 09, 2011 2:36 am",34,2747,World Football,Hernandez.
"I guess we know best, that kids must win and have tables at a young age hey ?? Lionel Messi and Co graduated from Barcelona's La Masia academy schooled in the fine art of the beautiful game By Henry Winter, Football Correspondent 05/05/2011 Barcelona’s fabulous Champions","Thu May 05, 2011 3:27 pm",58,36627,Coaching Football,Junior development is more important than points
he won't win this one,"Thu May 05, 2011 12:47 pm",48,4214,World Football,2010/11 Champions League Final
The simple fact is Messi wins games single handed.,"Thu May 05, 2011 12:33 pm",48,4214,World Football,2010/11 Champions League Final
"though, they don't have the midfield for it. If Rooney shows up they might have a chance, but he's going to have the play the game of his life. Messi showed last time why he was too good for them, and i can't see how the Man U team has changed enough to stop him still. In 09 we gave Barca too","Thu May 05, 2011 12:14 pm",48,4214,World Football,2010/11 Champions League Final
"though, they don't have the midfield for it. If Rooney shows up they might have a chance, but he's going to have the play the game of his life. Messi showed last time why he was too good for them, and i can't see how the Man U team has changed enough to stop him still.","Thu May 05, 2011 11:09 am",48,4214,World Football,2010/11 Champions League Final
barca do look like they do get favours from the refs however they are still the best team in the world regardless. watching messi is delightful,"Wed May 04, 2011 11:38 pm",62,5374,World Football,Real Madrid v Barcelona
about money?? :lol: :lol: Player - team - monthly salary - yearly salary 1. Cristiano Ronaldo – Real Madrid – €1.000.000 – €12.000.000 2. Lionel Messi – FC Barcelona – €875.000 – €10.500.000 3. Fernando Torres – Chelsea – €833.000 – €10.000.000 :oops: 4. Yaya Toure – Manchester City – €833.000-,"Tue May 03, 2011 6:27 pm",10,943,World Football,Top 100 Earners In Football
pretty rough call the red card challenging for the ball even though he caught him clean tough decision. messi is just amazing though what a second goal. Check out how 'clean' he caught him  What's he doing going,"Mon May 02, 2011 1:50 pm",62,5374,World Football,Real Madrid v Barcelona
