"Petr Cech, Sergio Ramos, Kompany, Bale, Micah Richards, Nigel De Jong, Jesus Navas, Cesc fabregas, Giovanni Dos Santos, Benzema, Aguero, Messi And Anderson.","Thu Jul 31, 2008 7:21 pm",45,4256,World Football,YOUR Favourite Players...
"Raffaele Palladino, Gigi Buffon, Paolo Maldini, Riccardo Montolivo, Andres Guardado, Francesco Modesto, Giandomenico Mesto, Sergio Aguero, Lionel Messi, Carlos Carmona, Christian Stuani, Bernardo Corradi, Fernando Meira, Ricardo Quaresma, Alexandre Pato, Maurizio Lanzaro, Salvatore Aronica, Franco","Thu Jul 31, 2008 7:06 pm",45,4256,World Football,YOUR Favourite Players...
"tevez, kezman, caldwell, vennegoor, canizares, silva, joaquin, luis garcia, tuncay, metzelder, lampard, deco, hildebrand, kolkka, frey, hleb, messi, maxwell, fabregas, rosicky, RVP, RVN, laursen, Tugay, MGP, nolan, k.davies, bullard, mcbride, niemi, kewell, van der dar, taylor, viduka, owen,","Thu Jul 31, 2008 2:42 pm",45,4256,World Football,YOUR Favourite Players...
"Larsson, Di Canio, Nakamura, Messi, Petrov, Saviola","Thu Jul 31, 2008 2:23 pm",45,4256,World Football,YOUR Favourite Players...
back to schoolyard banter now i feel slightly less intelligent for reading this,"Wed Jul 30, 2008 12:06 pm",102,13140,Amateur League,results 27th july
"messi, you had 24 hours to come up with a comeback and thats it?","Tue Jul 29, 2008 9:15 pm",102,13140,Amateur League,results 27th july
"Messi,awwwwww, c'mon.Please, please, please dont tell me and the forum thatPumas lost because of 3 or 4 yellow cards.Please!Remember, your 'credibility' is at stake.The ball of ridicule is in your court.","Mon Jul 28, 2008 11:24 pm",102,13140,Amateur League,results 27th july
"i beg to differ,,,Navarro and Denis","Fri Jul 25, 2008 8:02 am",218,13569,World Football,Napoli 08/09
"if Messi is 20, how the F*ck can there be a ""new Messi'????anyway, we already signed the 2 star Argies of Serie A - Zarate and Carrizo","Fri Jul 25, 2008 7:56 am",218,13569,World Football,Napoli 08/09
"Napoli Race Ahead Of Juve For ‘New Messi’ According to Tuttosport, Napoli and Juventus are fighting it out for the signing of Argentine prodigy Diego Buonanotte, however it seems that the Azzurri are ahead in the race. River Plate fantasista","Fri Jul 25, 2008 6:31 am",218,13569,World Football,Napoli 08/09
"Fabregas explained a lot of things to me about this club,"" Hleb told Barca TV. ""His time in the academy with players like (Gerard) Pique, (Lionel) Messi and so on. ""He loves this club. Now he's at Arsenal, but who knows if in the future he'll come back to Barca? ""He is my best friend at Arsenal,","Mon Jul 21, 2008 6:53 pm",0,259,World Football,Fabregas Could Follow Me To Barca
"If Ronaldihnio gets back the hunger he will score 15-20 goals this year himself. How many of Messi's great goals last year were set up by the interchange between the two. Still potentially twice the player of C Ronaldo Fair point Barca won everything playing Deco, Ronaldinho,","Thu Jul 17, 2008 9:06 pm",75,7814,World Football,OFFICIAL
"who has is it?Man Utd- Ronaldo, Rooney, TevezAC Milan- Ronaldino, kaka, PatoBarca- Messi, Eto, HenryReal Madrid- Robinho, Van Niesterooy, Raulthese are the 4 best in my opinion! in the correct order as well","Thu Jul 17, 2008 5:18 pm",31,1850,World Football,Who has the best front trio in club football
If Ronaldihnio gets back the hunger he will score 15-20 goals this year himself. How many of Messi's great goals last year were set up by the interchange between the two. Still potentially twice the player of C Ronaldo,"Thu Jul 17, 2008 4:59 pm",75,7814,World Football,OFFICIAL
"he is only 23. either way, those three are alot more world class than Giovanni Dos Santos talk about dreaming if the kid was that good (e.g. Messi) Barca wouldn't sell him to Spuds for 6mil I hope you don't think he chose Tottenham over Barca :clown: :lol:","Thu Jul 17, 2008 4:15 pm",83,4712,World Football,Will Arsenal Miss Out on Top Four IN EPL?
"exactly, 3 seasons ago the guy was unreal. did tricks out of this world, won the league and cl with barca. now we all say he is past it but the whole of the barca team, apart from messi, was past it last seasonstill a class act, will b a gun signin","Wed Jul 16, 2008 4:04 pm",75,7814,World Football,OFFICIAL
Daniele De Rossi ------------------- ---- Cristiano Ronaldo ------------------------------------------------------ Lio Messi ---------------------------------------------- Pele ------------------- Eric Cantona ------------------------------ Zlatan Ibrahimovic,"Wed Jul 16, 2008 11:55 am",61,3503,World Football,Your perfect 11
"GK:Jussi Jasskelinen RB:Zanetti CB:Terry CB:Ujfalusi LB:Milito RM:Hleb CM:Savage LM:Vicente AM:Lampard RF:Ibrahimovic LF:Messi Subs: Cudicini, Totti, Clichy, Villa, Parker, Owen, Neill Coach: Wenger Assistant Coach: Jose Mourinho Milito at LB???? Savage???? i kno hes not a natural","Wed Jul 16, 2008 8:47 am",61,3503,World Football,Your perfect 11
---------------Carizzo----------------- --Ramos----Cannavaro----Puyol----Grosso-- ---Messi----Hamsik----Kaka----Ronaldo--- --------Torres------------Lavezzi-------- Subs. Pele Pele's Ego Pele's Erection Id put the dikchead on last minute so to give Lavezzi a standing,"Wed Jul 16, 2008 7:19 am",61,3503,World Football,Your perfect 11
Milito at LB????Savage????,"Wed Jul 16, 2008 12:30 am",61,3503,World Football,Your perfect 11
"GK:Jussi JasskelinenRB:ZanettiCB:TerryCB:UjfalusiLB:MilitoRM:HlebCM:SavageLM:Vicente AM:LampardRF:IbrahimovicLF:MessiSubs: Cudicini, Totti, Clichy, Villa, Parker, Owen, NeillCoach: WengerAssistant Coach: Jose Mourinho","Tue Jul 15, 2008 5:55 pm",61,3503,World Football,Your perfect 11
---------------Casilas------------------Ramos---Ferdinand--Chielleni--Evra-----------Fabregas-----Gerrard----------Messi---------------------Ronaldo----------------Ronaldinho------------------------------Torres---------------,"Tue Jul 15, 2008 3:05 pm",61,3503,World Football,Your perfect 11
BuffonRamos Woodgate Nesta GrossoRonaldo Pirlo Modric Silva  Berbatov KeaneSubsTorresSneijderGerrardTottiMessiBosingwaCannavaro,"Tue Jul 15, 2008 2:36 pm",61,3503,World Football,Your perfect 11
Isnt he coaching Port Power??,"Tue Jul 15, 2008 8:23 am",61,3503,World Football,Your perfect 11
"gk: buffonlb: balecb: ferdinandcb: puyolrb: ramosrm: ronaldorcm: gerrardlcm: kakalm: silvast: torresst: messibench: casillas, evra, zanetti, cambiaso, pirlo, xavi, villa, ibrahimovic","Tue Jul 15, 2008 12:07 am",61,3503,World Football,Your perfect 11
Manager: Alex Ferguson. (It pains me to say that).Starting Eleven:GK: CasillasRB: RamosRCB: RioLCB: AggerLB: No idea.RM: RonaldoRCM: GerrardLCM: KakaLM:SilvaST: TorresST: MessiSubs:MascheranoBerbatovPuyolSneidjerZambrotta,"Mon Jul 14, 2008 7:38 pm",61,3503,World Football,Your perfect 11
"went on to speak of ""statistics, go have a look at [the] statistics"". Which is half the bloody problem. Does a team like Barcelona bring in Messi for his beep test-results? The fingerprints of the Australian Institute of Sport – where a belief system pervades that the quality and inherent","Sat Jul 12, 2008 8:09 pm",15,2511,"Australian National Football Teams - Socceroos, Olyroos, Matildas  etc",Arnie's flap and the devil in SBS
"with the squad. Apparently the Argentine Olympic team decided they didn’t need a third keeper to set up cones and fetch fresh water for Lionel Messi, Juan Roman Riquelme, Nicolas (who can I sucker punch now?) Burdisso in Beijing. I feel bad for Navarro but at least this forces Marino’s hand","Sat Jul 12, 2008 1:16 am",4,148,World Football,NAPOLETANA NEWS
Messi is under-23 so must be released.funny that FIFA doesn't recognize the comp but still have these rules.,"Thu Jul 10, 2008 12:28 am",157,11959,World Football,2008 Beijing Olympics
"What did Barca say to Ronnie? Haven't seen anything about that. Surely now that he is picked, he is picked.","Thu Jul 10, 2008 12:24 am",157,11959,World Football,2008 Beijing Olympics
"If Barca won't let Ronnie play, surely Messi will be out of the olympics too. They said he is required at pre-season training","Thu Jul 10, 2008 12:22 am",157,11959,World Football,2008 Beijing Olympics
"Games do not form part of the FIFA calendar therefore the club is not obliged to make its players available"". Argentina forward Lionel Messi is in a similar bind, and Barcelona have already written to the Argentine Football Association requesting that he be available for pre-season","Wed Jul 09, 2008 1:25 pm",1,136,World Football,Barca play hardball over Ronny
"and speed work as every other player in todays game so he would be even better!! He would dominate. The player he is most like in todays game is Messi, although he is/was a much better finisher than Messi 8)","Tue Jul 08, 2008 5:36 pm",53,943,World Football,DIEGO
"Lazio or a Napoli to a Scudetto!! the pace of Serie A wouldnt matter to him. its hard to stop a skilful dribbler or quick winger like Ronaldo and Messi, but its even harder to stop someone with Riquelme's vision.","Tue Jul 08, 2008 3:31 pm",53,943,World Football,DIEGO
"(Liverpool), Juan Roman Riquelme (Boca Juniors), Angel Di Maria (Benfica), Jose Sosa (Bayern Munich), Diego Buonanotte (River Plate), Lionel Messi (Barcelona), Ezequiel Lavezzi (Napoli), Lautaro Acosta (Sevilla) and Sergio Aguero (Atletico Madrid). discuss","Tue Jul 08, 2008 2:56 pm",157,11959,World Football,2008 Beijing Olympics
"appearances for serbia You will all definitely be hearing more from him in the coming years This is a huge call, but he reminds me of a potential messi caliber player I think this means goodbye to Klaas-Jan :cry: Is he Dutch?","Sat Jul 05, 2008 11:50 am",2,248,World Football,Biggest Ajax Transfer in History
"appearances for serbia You will all definitely be hearing more from him in the coming years This is a huge call, but he reminds me of a potential messi caliber player I think this means goodbye to Klaas-Jan :cry:","Sat Jul 05, 2008 8:13 am",2,248,World Football,Biggest Ajax Transfer in History
"Great call, and it applies to at least three quarters of Man U supporters in Australia.","Fri Jul 04, 2008 11:43 pm",12,1535,World Football,Arsenal sign Messi
funny sh1t,"Fri Jul 04, 2008 9:43 pm",12,1535,World Football,Arsenal sign Messi
good come back lefty.,"Fri Jul 04, 2008 9:28 pm",12,1535,World Football,Arsenal sign Messi
"hahaha cabernet team, cabernet sign lucky for you we musn't have won the league the first season you followed football or you would be a supporter :lol: and lucky for you it wasnt ManUSA wen you first watched or you would be supporting them! don't you mean unlucky, I could watch them win the tit","Fri Jul 04, 2008 9:21 pm",12,1535,World Football,Arsenal sign Messi
Haha well put,"Fri Jul 04, 2008 8:37 pm",12,1535,World Football,Arsenal sign Messi
and lucky for you it wasnt ManUSA wen you first watched or you would be supporting them!,"Fri Jul 04, 2008 7:16 pm",12,1535,World Football,Arsenal sign Messi
lucky for you we musn't have won the league the first season you followed football or you would be a supporter,"Fri Jul 04, 2008 5:01 pm",12,1535,World Football,Arsenal sign Messi
"club. Viviano is a superb keeper, so dont forget him. Marchisio and Acquafresca are going to be big things too. unfortunately the Argies have got Messi, Riquelme, Lavezzi and Aguero so I dont rate our chances of winning LOL","Fri Jul 04, 2008 3:51 pm",6,461,World Football,Italy's Squad For The Olympic Games
"Javier Mascherano (Liverpool), Jose Sosa (Bayern Munich). Forwards: Diego Buonanotte (River Plate), Sergio Aguero (Atletico Madrid), Lionel Messi (Barcelona), Ezequiel Lavezzi (Napoli), Angel Di Maria (Benfica) if his aim is to keep them under 10 goals. It's ok, we have Arnold as Coach and","Fri Jul 04, 2008 3:39 pm",26,4501,"Australian National Football Teams - Socceroos, Olyroos, Matildas  etc",Burns & Djite left out of Olyroos for Olympics!
"hahaha cabernet team, cabernet sign","Fri Jul 04, 2008 3:39 pm",12,1535,World Football,Arsenal sign Messi
"Javier Mascherano (Liverpool), Jose Sosa (Bayern Munich). Forwards: Diego Buonanotte (River Plate), Sergio Aguero (Atletico Madrid), Lionel Messi (Barcelona), Ezequiel Lavezzi (Napoli), Angel Di Maria (Benfica) if his aim is to keep them under 10 goals.","Fri Jul 04, 2008 3:00 pm",26,4501,"Australian National Football Teams - Socceroos, Olyroos, Matildas  etc",Burns & Djite left out of Olyroos for Olympics!
hahaha how stupid,"Fri Jul 04, 2008 12:12 pm",12,1535,World Football,Arsenal sign Messi
"just to further show that the heart of Argentina is Italian Inter, Milan and Roma are on red alert after Leo Messi's father confessed “My son dreams of Serie A.” The Barcelona starlet had always been considered untouchable, but could be allowed to move on this summer as part","Thu Jul 03, 2008 10:41 am",28,632,World Football,Argentine league
"midfielder Seydou Keita. Guardiola believes Alves could form a devastating partnership down the right flank with Barca's Argentine winger Lionel Messi. ""They are the two best players on the right flank and if they play well we'll have the best right side,"" said Guardiola. ""He's a player that","Thu Jul 03, 2008 10:41 am",6,308,World Football,Barca seal £23.5m deal for Alves
"has significant connections to Italian culture, also in terms of language, customs and traditions. such Italians include Diego Maradona and Lionel Messi. Argentina e` Italia, non c'e 'na differenza","Wed Jul 02, 2008 11:48 pm",28,632,World Football,Argentine league
"sounds the goods. the Argies are briliant all over the field - see Messi, Tevez, Zanetti, Cambi, Riquelme. a great keeper could send them a long way in 2010","Tue Jul 01, 2008 7:25 pm",5,112,World Football,Juan Pablo Carrizo
"shiraz i knew he was good but not this goodHis a good example for size doesn't matter modric as well Those two plus Messi are amazing players considering how much they would get bashed around every game. I hope Arshavin goes tothe continent, he would tear it up wherever he goes","Sun Jun 22, 2008 10:53 pm",23,632,World Football,Arshavin to Arsenal or Chelski
18 million for Palacio??? maybe he will sign.,"Thu Jun 19, 2008 8:49 pm",12,499,World Football,Lazio Line Up Shock Move For Riquelme
hahahahahhahahaha yeah Im sure we aremaybe we are gonna sign Messi as well,"Thu Jun 19, 2008 8:48 pm",12,499,World Football,Lazio Line Up Shock Move For Riquelme
Pilots we won't care if you play in the rematch because MESSI will clean you up all game Messi is hitting great form and will be up for the rematch. And yeh gullys did play well on the day but Our First team boys were unlucky in the game because we,"Fri Jun 13, 2008 3:55 pm",15,3134,Amateur League,Pumas vs Vista
Pilots we won't care if you play in the rematch because MESSI will clean you up all game Messi is hitting great form and will be up for the rematch. And yeh gullys did play well on the day but Our First team boys were unlucky in the game because we hit,"Fri Jun 13, 2008 2:33 pm",15,3134,Amateur League,Pumas vs Vista
"Messi, You will get my response underlights in the rematch - where this time i'll play!!!Hope your playing.","Fri Jun 13, 2008 11:30 am",15,3134,Amateur League,Pumas vs Vista
"Messi - I call it - pretty funny reallybut you'll note we have only let 3 goals in since then (in 4 games) scored 9, not lost since and taken 8 points out of a max 12 - but you dont see us on here saying we are ""and to quote - ""on the up""????","Thu Jun 12, 2008 9:28 am",15,3134,Amateur League,Pumas vs Vista
"Qualifier Live action from El Monumental, Buenos Aires, as Argentina take on Ecuador. The Argentinian fans will be hoping that star striker Lionel Messi can inspire his team to a home victory. K.O. 6:40am 8:45am Internationals Live: Bolivia v Chile - World Cup 2010 Qualifier Live action from the","Mon Jun 09, 2008 9:24 pm",5,224,World Football,Hey Bodø
"man utd get 80 mill for him, they can pick up messi for say 30 or 40 (if he wants to go) and u still have 40 left over, plus im sure madrid will include a player or two in the deal, imagine robinho and messi at united? it makes sense, they should let him go","Mon Jun 09, 2008 4:41 pm",32,2249,World Football,HE'S OFF TO MADRID?
"next year, where ever he plays,,,he will have an average year. kid needs more humility,,, eg messi, kaka Maradona was never humble but then Ronaldo is not Maradona, he is not even the greatest Ronaldo of all time :D correct,,,no comparison. as much as i love cristiano","Sun Jun 08, 2008 9:16 pm",32,2249,World Football,HE'S OFF TO MADRID?
any day of the week messi is class,"Sun Jun 08, 2008 6:20 am",32,2249,World Football,HE'S OFF TO MADRID?
"true messi, who'd have thought gully would draw with croatia or grove would draw with fulham","Sat Jun 07, 2008 1:01 pm",37,5709,Amateur League,round 7 div 2 sunday
he can go for £100m madrid are as bad as chelsea when it comes to pay outrageous transfer fees.rather see him go to barcelona a straight swap for messi,"Sat Jun 07, 2008 10:47 am",32,2249,World Football,HE'S OFF TO MADRID?
"correct,,,no comparison.","Fri Jun 06, 2008 12:31 pm",32,2249,World Football,HE'S OFF TO MADRID?
"Maradona was never humblebut then Ronaldo is not Maradona, he is not even the greatest Ronaldo of all time","Fri Jun 06, 2008 12:25 pm",32,2249,World Football,HE'S OFF TO MADRID?
"next year, where ever he plays,,,he will have an average year. kid needs more humility,,, eg messi, kaka","Fri Jun 06, 2008 9:49 am",32,2249,World Football,HE'S OFF TO MADRID?
"Napoli Post subject: Re: Ronaldo: News In Three Days Numba 7 wrote: why dont we sell him now, get our 80 million euros and sign LIONEL MESSI!!! ill be more then happy with that I doubt Messi will leave Barca for Man U why not? ronaldinho is leaving. eto is possibly leaving. why wouldnt messi","Wed Jun 04, 2008 4:19 pm",27,2524,World Football,Ronaldo
I doubt Messi will leave Barca for Man U,"Wed Jun 04, 2008 4:16 pm",27,2524,World Football,Ronaldo
i want him 2 stay. but if he does somehow really leave then why not bring in the best player in the world MESSI!!,"Wed Jun 04, 2008 2:38 pm",27,2524,World Football,Ronaldo
Gee on msn you said he wont be leaving. Now you want to cash in on him. Make up your mind,"Wed Jun 04, 2008 2:32 pm",27,2524,World Football,Ronaldo
"why dont we sell him now, get our 80 million euros and sign LIONEL MESSI!!! ill be more then happy with that","Wed Jun 04, 2008 2:01 pm",27,2524,World Football,Ronaldo
"Cole and Hargreaves have a range of creative attributes to compete with any in Europe and while England have no equivalent of Ronaldo or Lionel Messi, neither do many others. When Ronaldinho came up short for Brazil at the previous World Cup there was no production line of creative geniuses","Thu May 29, 2008 12:28 pm",11,442,World Football,Not good for Three lions
"midfielder has proved himself to be a leader on the pitch this season and capped a splendid season by lifting the Coppa Italia. 7. Lionel Messi (Barcelona, La Liga) - He may have ended the season without a trophy, but there is no doubting that Messi has been one of the highlights of the","Wed May 28, 2008 9:46 am",6,377,World Football,European team of the season
"na na the real reason we should be careful of Spain.. one of them might lose it and attempt to break the legs of an Aquilani, Pirlo or Di Natale. they tried it on Maradona, they try it on Messi, they might try it on uslfty your thoughts on Panucci's inculsion??","Fri May 23, 2008 7:19 pm",119,5247,World Football,EURO 2008
Is Messi available?,"Tue May 20, 2008 9:56 pm",46,2091,World Football,LAZIO 2-1 NAPOLI
"is likely to take his distinctive party to Italy, and Milan. Also linked with a Catalan exit have been Thierry Henry (more of that later), Lionel Messi (because he's good), Deco (because he's not) and Samuel Eto'o (because he's indifferent). Deco looks most likely to arrive on these shores, with","Tue May 20, 2008 1:03 pm",28,3065,World Football,Premier League - Transfer Talk.
"Just viewing this list of strikers from the last 8 of the Champion's League Rooney, Tevez, Drogba, Anelka, Adebayor, Van Persie, Torres, Kuyt, Messi, Henry, Deivid, Kazim, Vucinic, Totti, Kuranyi, Asamoah With no restrictions on money, it still depends what system of personnel you have around","Tue May 20, 2008 9:23 am",95,8523,World Football,f.torres v c.ronaldo
think he's past it. Anyone watching the CL semi final against Manchester United should be able to see how good he still is. People raved about Messi but Deco in the middle was untouchable. Our midfield couldn't get near him. All the simple one touch passes kept his team playing just how they,"Fri May 16, 2008 7:10 pm",16,702,World Football,Barca show Deco the door
"awards and was hailed by many, including hitherto sceptics, as the best player in the world at the moment. Barcelona's Argentine magician Lionel Messi might justifiably challenge that status, but it would be a very close contest, and United's Portuguese star was without question the Premier League's","Thu May 15, 2008 12:53 pm",56,1164,World Football,epl team of the season
"watching, some people may enjoy tactical, defensive football and others enjoy dribbling and trickery as practised by Robinho, Robben, Ronaldo, Messi, Ronaldinho etc. In the end though I don't think anyone can say that Real Madrid didn't deserve the title. even Windsor Gardens Old Scholars could","Sat May 10, 2008 1:02 pm",17,999,World Football,Real Madrid 4 - 1 Barcelona
Jose Paolo Guerrero and are prepared to smash the club record transfer in their hunt for a striker. (Daily Mirror ) Chelsea are not after Lionel Messi but do want to sign France star Franck Ribery from Bayern Munich. (Daily Telegraph),"Fri May 09, 2008 9:19 am",2,335,World Football,TRANSFER RUMOURS
"Kaka: Milan, buy me Messi! Wednesday 7 May, 2008 -------------------------------------------------------------------------------- If Ronaldinho isn’t set to join Milan, then Kaka has asked for another Barcelona star – Lionel Messi.","Thu May 08, 2008 7:27 pm",0,122,World Football,Kaka
"for their turn to do a drill, and then playing on a full size pitch where are they touch the ball 2 or 3 times the whole game. Maradona, Zico, Messi, Ronaldinho, Kaka, C. Ronaldo, Robben, Van Persie etc, etc, etc they didnt go to huge rich academies at 6 yo. They played small games EVERY day,","Thu May 08, 2008 7:44 am",190,21160,Junior Football,E&D
"I'll agree with that, Ronaldo and Messi on the wings V the likes of Zat Knight and Grahame Murty  .","Sun May 04, 2008 10:07 pm",49,7013,World Football,manchester united v West Ham United
C. RonaldoMessiKakaFerdinandGerrardTorresFabregasDrogbaTerryHenry,"Sun May 04, 2008 8:34 pm",24,2529,World Football,TOP 10 CURRENT PLAYERS IN THE WORLD?
How good would that be???? Gold!!,"Sun May 04, 2008 3:09 pm",49,7013,World Football,manchester united v West Ham United
"2 different players. messi creates, ronaldo scoresjst imagine them at the same team. bring messi 2 OT i say ;)","Sun May 04, 2008 2:24 pm",49,7013,World Football,manchester united v West Ham United
C.Ronaldo Messi KakaFabregasVidic Drogba GerrardCannavaro RooneyTerry,"Sun May 04, 2008 2:11 pm",24,2529,World Football,TOP 10 CURRENT PLAYERS IN THE WORLD?
"first goal was good, but i think the second was lucky, if it was any other player the commentators would be saying ""he certainly didn't mean that"" Messi > Ronaldo though, he is 2nd in the world i will give him that :wink: Not too sure about this. They were pretty even in the last encounter. Ronaldo","Sun May 04, 2008 2:05 pm",49,7013,World Football,manchester united v West Ham United
"first goal was good, but i think the second was lucky, if it was any other player the commentators would be saying ""he certainly didn't mean that"" Messi > Ronaldo though, he is 2nd in the world i will give him that :wink:","Sun May 04, 2008 1:38 pm",49,7013,World Football,manchester united v West Ham United
MessiRonaldoTorresKakaFabregasFerdinandGerrardEssienToniDrogba,"Sun May 04, 2008 1:26 pm",24,2529,World Football,TOP 10 CURRENT PLAYERS IN THE WORLD?
"ronaldotorresfabregasmessisanta cruz (may not be worlds most known player, but he is in some form)tonigerrard essienballackpuyol","Sun May 04, 2008 12:52 pm",24,2529,World Football,TOP 10 CURRENT PLAYERS IN THE WORLD?
C RonaldoKakaMessiGerrardFabregasTorresDrogbaCannavaroRonaldinhoTerryThers my 10 champ,"Sat May 03, 2008 11:17 pm",24,2529,World Football,TOP 10 CURRENT PLAYERS IN THE WORLD?
be: Cristiano Ronaldo Kaka Francesc Fabregas Iker Casillas Steven Gerrard Didier Drogba Michael Essien Fernando Torres Francesco Totti Leonel Messi,"Sat May 03, 2008 10:30 pm",24,2529,World Football,TOP 10 CURRENT PLAYERS IN THE WORLD?
C. RonaldoMessiTorresToniSanta CruzGerrardIbrahimovicFabregasDrogbaTotti,"Sat May 03, 2008 7:45 pm",24,2529,World Football,TOP 10 CURRENT PLAYERS IN THE WORLD?
MessiC. RonaldoGerrardIbrahimovicFabregasKakaTorresDrogbaEssienCassilasThat's my top ten.,"Fri May 02, 2008 11:58 pm",24,2529,World Football,TOP 10 CURRENT PLAYERS IN THE WORLD?
My pick would be: Messi C. Ronaldo Ballack Ibrahimovic Henry ?? Kaka Ronaldinho ?? Drogba Essien Cannavaro Neither can be included. Ronaldihno has been no existent for the last few months and Henry is only appearing off the bench.,"Fri May 02, 2008 9:59 pm",24,2529,World Football,TOP 10 CURRENT PLAYERS IN THE WORLD?
My pick would be:MessiC. RonaldoBallackIbrahimovicHenryKakaRonaldinhoDrogbaEssienCannavaro,"Fri May 02, 2008 5:10 pm",24,2529,World Football,TOP 10 CURRENT PLAYERS IN THE WORLD?
"if it is the one in the first minute where scholes took out messi..it was just out..on the line to be exact, but isnt it a penalty if contact is on the line??","Wed Apr 30, 2008 9:04 pm",9,498,World Football,Barca penalty?
