FOR HIM TO SCORE 4ABSOLUTE CHAMP!like to see next game vs inter.,"Wed Apr 07, 2010 7:27 am",135,13471,World Football,Messi
rooney has nothing over messi,"Wed Apr 07, 2010 7:14 am",135,13471,World Football,Messi
"some Millwall fans are hoping messi signs to play alongside him for next season. Personally, I don't want an argie near my club, anyway Steve Morrison is better.","Wed Apr 07, 2010 6:15 am",135,13471,World Football,Messi
Haha Harris. Um yeh he's pretty damn good.,"Wed Apr 07, 2010 6:12 am",135,13471,World Football,Messi
"how bottle of shiraz good is he, he's up there with the likes of rooney and neil harris.","Wed Apr 07, 2010 6:09 am",135,13471,World Football,Messi
A bright start but a first half Messi hatrick has them on the ropes. Difficult to see them coming back now.,"Wed Apr 07, 2010 5:21 am",16,1285,World Football,Arsenal in the Nou Camp
"he doesnt have a club at present. 4. he struggled in the A League this year. You want this quality on the world stage? can you imagine a Rooney, Messi or Ronaldo running at Craig Moore it doesnt paint a pretty picture and you dont groom youth 2 months before a world cup. You take experience","Mon Apr 05, 2010 12:20 am",39,2995,"Australian National Football Teams - Socceroos, Olyroos, Matildas  etc",is Ognenovski worth a spot in the Socceroo's squad?
yea barca were great until walcott came on. and where was this messi bloke lol quite poor refing too.,"Thu Apr 01, 2010 7:07 pm",19,2334,World Football,Barca - best ever?
"he doesnt have a club at present. 4. he struggled in the A League this year. You want this quality on the world stage? can you imagine a Rooney, Messi or Ronaldo running at Craig Moore it doesnt paint a pretty picture the point i was making is he is an international with 50 caps in his","Wed Mar 31, 2010 11:24 pm",39,2995,"Australian National Football Teams - Socceroos, Olyroos, Matildas  etc",is Ognenovski worth a spot in the Socceroo's squad?
Phil prefers the Sun or News of the World,"Wed Mar 24, 2010 5:31 pm",5,783,World Football,More on Messi
No idea.,"Wed Mar 24, 2010 5:25 pm",5,783,World Football,More on Messi
"[quote=""Scudetto8687""]The Guardian is a brilliant paper..[quote]. if you've run out of bog roll","Wed Mar 24, 2010 4:38 pm",5,783,World Football,More on Messi
Dr Sid is an excellent writer. Always read his columns - and listen to him on the Guardian weekly pod.,"Wed Mar 24, 2010 3:27 pm",5,783,World Football,More on Messi
please read the quote,"Wed Mar 24, 2010 2:14 pm",15,657,World Football,Di Natale
" The Guardian is a brilliant paper. This is a great article, the link for people that have the time, but I have paraphrased a few stats below.. ""It's not just the","Wed Mar 24, 2010 1:37 pm",5,783,World Football,More on Messi
Natale is hardly an unknown quantity but many might still be surprised to see him competing with the likes of superstars Wayne Rooney and Lionel Messi for this season's European Golden Shoe (formerly Golden Boot) award as the best marksman in European club football. The focus of attention on,"Wed Mar 24, 2010 1:00 pm",15,657,World Football,Di Natale
Not really.,"Tue Mar 23, 2010 9:02 am",27,991,World Football,"Messi, another hatrick"
A bit like Fulham then?,"Tue Mar 23, 2010 8:59 am",27,991,World Football,"Messi, another hatrick"
Which one Scary they he can miss 2 sitters and they still score 4.,"Mon Mar 22, 2010 10:34 pm",27,991,World Football,"Messi, another hatrick"
"hes a gun, but its seems like a case of if arsenal can stop messi, who will step up? mentioned before Xavi and Iniesta plus Pedro is a speedy little guy. Kieta has popped up to score important goals so even without Messi firing Barca still have the muscle","Mon Mar 22, 2010 10:15 pm",27,991,World Football,"Messi, another hatrick"
11 in 5 games - does it all on his own; whether his team mates decide to play well or not. As good as Rooney is - especially right now - Leo is just in his own class.,"Mon Mar 22, 2010 7:41 pm",27,991,World Football,"Messi, another hatrick"
Ibra's miss.,"Mon Mar 22, 2010 7:27 pm",27,991,World Football,"Messi, another hatrick"
hes a legend,"Mon Mar 22, 2010 7:13 pm",27,991,World Football,"Messi, another hatrick"
well there has only been one argentinian who has won the world cup on his own i wonder if messi can too yeah i wonder whether he'll have to cheat to do it as well. Still crying about that. A lot of teams can feel hard done by for one reason or another at a world cup.,"Mon Mar 22, 2010 7:05 pm",27,991,World Football,"Messi, another hatrick"
"ppfffftt - whatever, if he hadn't cheated for the first goal then the second one probably wouldn't have happened and even if it did then it would've been 1-1 and given we all know how good england are at penalties i think we all know the history books would read differently. Come on, you're clutchi","Mon Mar 22, 2010 4:52 pm",27,991,World Football,"Messi, another hatrick"
well that draw didnt happen in 1986 did it lol,"Mon Mar 22, 2010 4:50 pm",27,991,World Football,"Messi, another hatrick"
i wonder if messi can too[/quote] yeah i wonder whether he'll have to cheat to do it as well.[/quote] Still crying about that. A lot of teams can feel hard done by for one reason or another at a world cup. Did he cheat when he sat,"Mon Mar 22, 2010 4:36 pm",27,991,World Football,"Messi, another hatrick"
"thanks for your input, good result last night for your mob","Mon Mar 22, 2010 4:29 pm",27,991,World Football,"Messi, another hatrick"
get over it,"Mon Mar 22, 2010 4:28 pm",27,991,World Football,"Messi, another hatrick"
hahahaha.,"Mon Mar 22, 2010 3:27 pm",27,991,World Football,"Messi, another hatrick"
yeah i wonder whether he'll have to cheat to do it as well.,"Mon Mar 22, 2010 3:18 pm",27,991,World Football,"Messi, another hatrick"
well there has only been one argentinian who has won the world cup on his owni wonder if messi can too,"Mon Mar 22, 2010 3:11 pm",27,991,World Football,"Messi, another hatrick"
"that run was amazing, how many goals is that in the last 5 games for him now?stil young, if hes not at his prime yet then we are in for a treat when he is!","Mon Mar 22, 2010 2:36 pm",27,991,World Football,"Messi, another hatrick"
D.A.M???????,"Mon Mar 22, 2010 2:09 pm",27,991,World Football,"Messi, another hatrick"
"If Argentina can manage to win the world cup at some stage in his career, he could go down as the greatest ever.I cant believe what I see when I see him play, reminds me of another little argentinian bloke about 25 years ago. And Im not talking about Ossie Ardiles","Mon Mar 22, 2010 1:40 pm",27,991,World Football,"Messi, another hatrick"
Thing with barca is that anyone can step up. Xavi and Iniesta weren't even playing on the weekend ( iniesta came on later). So you'd assume with that added fire in the midfield they'll be more than capable.,"Mon Mar 22, 2010 1:38 pm",27,991,World Football,"Messi, another hatrick"
"hes a gun, but its seems like a case of if arsenal can stop messi, who will step up?","Mon Mar 22, 2010 1:31 pm",27,991,World Football,"Messi, another hatrick"
love watching him.he inspires me to love football more an gafl moretalented an gifted kiddlegend!!!!!,"Mon Mar 22, 2010 1:15 pm",27,991,World Football,"Messi, another hatrick"
Will win player of the year again.Deserves to as well.,"Mon Mar 22, 2010 1:13 pm",27,991,World Football,"Messi, another hatrick"
The run that wins the pemalty that Ibra scores is amazing.,"Mon Mar 22, 2010 1:04 pm",27,991,World Football,"Messi, another hatrick"
He's on a different level to everyone elsetruly amazing.,"Mon Mar 22, 2010 1:03 pm",27,991,World Football,"Messi, another hatrick"
Just watched the Barca game. Messi with another hat-trick. Messi's scored 8 goals in the past 3 games and back to back hat-tricks in the League.I'm so glad we don't have to meet them until the final.,"Mon Mar 22, 2010 12:31 pm",75,3637,World Football,CL Draw
"quote] and why is that? Ibrahimovic >>>>>>>>>>>>>> Bendtner Messi >>>>>>>>>>> Anyone Thats part of the reason. The main reason though is Barca > Arsenal. Well now you have made it so clear with that in depth analogy, i totally agree LMAO!!! :clown:[/quote]","Mon Mar 22, 2010 9:54 am",75,3637,World Football,CL Draw
"quote] and why is that? Ibrahimovic >>>>>>>>>>>>>> Bendtner Messi >>>>>>>>>>> Anyone Thats part of the reason. The main reason though is Barca > Arsenal. [/quote] Well now you have made it so clear with that in depth analogy, i totally agree LMAO!!! :clown:[/quote]","Mon Mar 22, 2010 8:42 am",75,3637,World Football,CL Draw
"Well now you have made it so clear with that in depth analogy, i totally agree LMAO!!!","Sun Mar 21, 2010 9:27 pm",75,3637,World Football,CL Draw
lol @ clichy stopping messi :lol: clichy is back in form with his pace and in form he can be very good. any team will need more than one player to stop lionel messi obviously. some cant stop him with 11. but gael can at least match,"Sun Mar 21, 2010 7:52 pm",75,3637,World Football,CL Draw
any team will need more than one player to stop lionel messi,"Sun Mar 21, 2010 7:47 pm",75,3637,World Football,CL Draw
/sigh,"Sun Mar 21, 2010 7:46 pm",75,3637,World Football,CL Draw
clichy is back in formwith his pace and in form he can be very good.,"Sun Mar 21, 2010 7:44 pm",75,3637,World Football,CL Draw
lol @ clichy stopping messi,"Sun Mar 21, 2010 5:44 pm",75,3637,World Football,CL Draw
"reckon they can be stopped over two legs ive been watchin barca's highlights, stats etc for the past few games. and they are playing alot around messi, ive noticed xavi has been a bit quiet, zlatan is not even on the radar, and lets face it, its a big game so hell be nowhere in the CL tie. they","Sun Mar 21, 2010 4:26 pm",75,3637,World Football,CL Draw
"would have the points with the away goal rule.So Arsenal do not need to out score Barca to procede to the next round.0-0 at home, 1-1 away with Messi scoring would be enough.Wether it happens or not well thats another story. I hate fishing.","Sun Mar 21, 2010 4:22 pm",75,3637,World Football,CL Draw
Ibrahimovic >>>>>>>>>>>>>> BendtnerMessi >>>>>>>>>>> AnyoneThats part of the reason. The main reason though is Barca > Arsenal.,"Sun Mar 21, 2010 1:39 pm",75,3637,World Football,CL Draw
have faith. bendtner to score the winner :) So who's going to score the other 16 goals just to equalise before Bendtner scores that winner? :wink: Messi is gonna have a field day. Arsenal will cause the Barca defence jus as much problems!! I dont see how you can write Arsenal off see easily. We,"Sun Mar 21, 2010 7:07 am",75,3637,World Football,CL Draw
Europa League: where big clubs go to die,"Sun Mar 21, 2010 6:26 am",75,3637,World Football,CL Draw
Oh I am. I am thankful each and every day that Rafa had the foresight to throw games and get us into the Europe League. Stunning management. In Rafa We Trust!,"Sat Mar 20, 2010 10:28 pm",75,3637,World Football,CL Draw
Just be thankful Liverpool aren't there then,"Sat Mar 20, 2010 10:24 pm",75,3637,World Football,CL Draw
So who's going to score the other 16 goals just to equalise before Bendtner scores that winner?  Messi is gonna have a field day.,"Sat Mar 20, 2010 10:17 am",75,3637,World Football,CL Draw
"Messi Vs Clichy, Eboue?, Campbell Arsenal might aswell forfeit.","Fri Mar 19, 2010 11:09 pm",75,3637,World Football,CL Draw
You must be relievedMessi gets to rape Arsenal's defense.,"Fri Mar 19, 2010 10:46 pm",75,3637,World Football,CL Draw
"Yeah, cause the group-stage game was so excitingI don't care who Man Utd get as long as it's not Barca. With Messi's current form he will rape our defence.","Fri Mar 19, 2010 5:11 pm",75,3637,World Football,CL Draw
rooney is having a top year but i still reckon messi is just ahead of him,"Thu Mar 18, 2010 9:54 pm",41,2184,World Football,Castrol Rankings
rooney isnt number 1 bcoz messi is the best player by a mile,"Wed Mar 17, 2010 1:50 pm",41,2184,World Football,Castrol Rankings
Gerrardo Bruna as well. Pretty sure it was him anyway.,"Mon Mar 15, 2010 6:10 pm",8,1469,World Football,Barca sign South Korean starlet
"to the Sweden national national team. Until he fixes these inconsistencies, he doesn’t deserve to be mentioned in the same breath as the Lionel Messi’s and Wayne Rooney’s of this world. 8) Rio Ferdinand (Manchester United): Always relying on his partner in central defence - Nemanja Vidic or","Sun Mar 14, 2010 5:44 pm",30,1970,World Football,goal.com list of 10 overrated footballers:
on payers that are slightly rough then every time he will play in the future the opposition will play rough with him. Players like Ronaldo and Messi get their legs hacked every week yet seem to kill teams. If Theo can learn to deal with it he will become world class player everyone seems to,"Tue Mar 09, 2010 1:32 pm",57,3517,World Football,Unimpressive Walcott
"Just because he hasn't developed as quickly as the likes Rooney, Cesc and Messi doesn't mean he will develop into a world class player. If he wasn't English the pressure wouldn't be so great. I reckon a loan to a lower league to develop his skills would help.","Tue Mar 09, 2010 10:08 am",57,3517,World Football,Unimpressive Walcott
New Messi's:Bojan KrkicGiovani Dos SantosGai AssulinSebastian Giovinco Korean GuyWhen will they learn a player like Messi doesnt just come around every transfer period,"Mon Mar 08, 2010 11:32 am",8,1469,World Football,Barca sign South Korean starlet
"to have prevailed in that particular battle, with the Asian ace opting for Camp Nou over Santiago Bernabeu. Park, who has been dubbed 'the Korean Messi', first caught the eye of European scouts during a youth tournament in 2009. It was apparent that he possessed great ability and could be a potential","Sun Mar 07, 2010 7:28 pm",8,1469,World Football,Barca sign South Korean starlet
"adler may not play, i'm going a germanhunt, ozil, hummels, kroos, muller all likely to be involvedmaybe a big name like messi or aguero but lots of pressure to peform so maybe people will expect to muchsuarez is a good bet but uruaguy need cavani and forlan on form also to help him","Thu Mar 04, 2010 11:16 pm",39,4551,World Football,Who will be the best young player at the World Cup
"Fletcher's ball for rooneys goal was excellent. good result at the san siro[/quote] reminded me of the lil chip ineasta gave 2 messi in last seasons cl, right between the 2 defenders rooney was nowhere in the 1st half, only had that shot that jst went wide, but exploded in the 2nd[/quote]","Thu Feb 18, 2010 4:04 pm",45,3653,World Football,Milan v Man United
"overall good performance. Fletcher's ball for rooneys goal was excellent. good result at the san siro reminded me of the lil chip ineasta gave 2 messi in last seasons cl, right between the 2 defenders rooney was nowhere in the 1st half, only had that shot that jst went wide, but exploded in the 2nd","Wed Feb 17, 2010 6:53 pm",45,3653,World Football,Milan v Man United
"I know Hamsik is no Messi, but he would walk into most sides. Apart from Fabregas, what player in Spain or England would be up to his standard as a free scoring central midfielder? Pato is the same - I leave guys like Rooney out of","Wed Feb 17, 2010 2:12 pm",34,1659,World Football,serie A
"I know Hamsik is no Messi, but he would walk into most sides.Apart from Fabregas, what player in Spain or England would be up to his standard as a free scoring central midfielder?Pato is the same - I leave guys like Rooney out of the equation because he is now 24. Lets only talk guys 23 and under.","Wed Feb 17, 2010 2:00 pm",34,1659,World Football,serie A
"pato and hamsik need to make then next step to be talked about alongside fabregas and messi, but did i not say they a great players, but when people talk world class young players, they are not mentioned","Wed Feb 17, 2010 1:58 pm",34,1659,World Football,serie A
"good but i feel overall the younger players lack the quality seen in other leagues, how old is borrielo? epl has fabregas at 21 and la liga has messi at 21, who does serie a have? [/quote] Pato @ 20?[/quote] Hamsik??? 22 same age as Messi, or a years difference. Santon - 18?? Okaka Chuka 20?","Wed Feb 17, 2010 1:43 pm",34,1659,World Football,serie A
"good but i feel overall the younger players lack the quality seen in other leagues, how old is borrielo? epl has fabregas at 21 and la liga has messi at 21, who does serie a have? Pato @ 20?","Tue Feb 16, 2010 5:11 pm",34,1659,World Football,serie A
"good but i feel overall the younger players lack the quality seen in other leagues, how old is borrielo? epl has fabregas at 21 and la liga has messi at 21, who does serie a have? Whats him being Chilean got to do with it - i fail to understand the argument - are you saying there are no good","Tue Feb 16, 2010 3:48 pm",34,1659,World Football,serie A
"good but i feel overall the younger players lack the quality seen in other leagues, how old is borrielo? epl has fabregas at 21 and la liga has messi at 21, who does serie a have?","Tue Feb 16, 2010 2:52 pm",34,1659,World Football,serie A
"for Inter they've peaked in Serie A at the time when the league is paying for the excesses of previous. 15 years ago Inter would have brought Messi to Serie A, today we lose Ibra to Barca.","Tue Feb 16, 2010 11:46 am",34,1659,World Football,serie A
Add Rooney and Messi to that list,"Fri Feb 12, 2010 9:01 pm",39,4551,World Football,Who will be the best young player at the World Cup
Longbomb back at the Beach after 1 year in Spain teaching Messi and Ronaldo some new tricksHe was going to stay at Barca but he wasn't too fond of the Tapas and couldn't find a shop that had a decent Mars bar and Red bull special on !!,"Fri Feb 05, 2010 4:20 pm",19,4258,Amateur League,CONFIRMED PLAYER MOVEMENTS
"Bayern Munich playmakerFranck Ribery would jump at the chance to play alongside Lionel Messi at Barcelona, according to his agent. Ribery's representative, Alain Migliaccio, has said that the France forward has not closed the door on a move anywhere and would welcome","Fri Feb 05, 2010 1:52 pm",1,153,World Football,Agent hints at Ribery Barca move
"Except for Messi, Torres, Ronaldo he may be.","Tue Jan 26, 2010 9:53 pm",41,3658,World Football,Man City to offer £100 million for Torres
"because while i think most of the time he's quite solid, against world class players he crumbles a bit ( Drogba, Torres). I could see Ibra and Messi doing quite a number on him. Having said all that i don't think he's for sale, it's all just hype like the Rooney bid. As for Ribery, it's hard","Fri Jan 15, 2010 4:46 pm",198,11893,World Football,january transfer window
"Serie A can't afford the top stars anymore Scud. That's why he, messi , ronaldo, the new generation of superstars who are on big bucks can not be catered for by Serie A. Think the axis of european football will be shifting back to Italy again shortly: However,","Tue Jan 12, 2010 6:44 pm",58,4476,World Football,Sneijder
"He clearly stated why he wanted to go to Barca, any centre forwarded who wanted to be regarded as the world best wouldn't turn done service from Messi, Xavi & Iniesta either. Not sure why anyone would expect Inter to refuse an offer which meant they could buy Sneijder, Lucio, Motta, Milito, have","Tue Jan 12, 2010 4:30 pm",58,4476,World Football,Sneijder
"Serie A can't afford the top stars anymore Scud . That's why he, messi , ronaldo, the new generation of superstars who are on big bucks can not be catered for by Serie A. Kaka and Ibrahimovic were the top two paid players in the world last year, thats fact,","Tue Jan 12, 2010 1:04 pm",58,4476,World Football,Sneijder
How many players on a team? 1?,"Tue Jan 12, 2010 1:03 pm",55,4473,World Football,Man United To Consider Bond Issue - lol
"Serie A can't afford the top stars anymore Scud. That's why he, messi , ronaldo, the new generation of superstars who are on big bucks can not be catered for by Serie A.","Tue Jan 12, 2010 12:52 pm",58,4476,World Football,Sneijder
"he nearly too england to glory in euro 04 until he got injuredworld cup 06 he was unfit when he got that metetasial injury against chelsea 2wards end of the seasona fit rooney, look out, im expecting him and messi 2 have big world cupsronaldo cnt perform for club","Tue Jan 12, 2010 12:23 pm",55,4473,World Football,Man United To Consider Bond Issue - lol
Much better World XI GK Casillas LB Abidal CB Puyol CB Vidic RB Maicon RCM Iniesta CM Alonso LCM Xavi RST Messi CF Ibrahimovic LST Ronaldo lol at vidic Vidic is one of those people i'm putting in because we all know how good he can be. Alonso is a player I would put it for,"Tue Dec 29, 2009 1:21 am",15,1175,World Football,Barcelona's Thierry Henry the number one player in the world
Ok old man,"Mon Dec 28, 2009 11:03 am",41,4479,World Football,Messi the Greatest
"Yes, but the first one I would have learnt before you were born.","Mon Dec 28, 2009 9:50 am",41,4479,World Football,Messi the Greatest
"That's 2 things you have learnt, well done","Mon Dec 28, 2009 9:37 am",41,4479,World Football,Messi the Greatest
"You are indeed correct. How ever, seven is not one.","Mon Dec 28, 2009 8:57 am",41,4479,World Football,Messi the Greatest
Its 7 playersYour lack of faith disturbs me,"Mon Dec 28, 2009 7:50 am",41,4479,World Football,Messi the Greatest
"win a world cup on ur own and then u can b called the greatest Can't be done. You need eight players on the park for a game to commence/continue. Oh look everyone we have a comedian!! Look at the 86 World Cup, You'll see what im talking about :wink: So what you're saying is that the Argentinian def","Sun Dec 27, 2009 8:47 pm",41,4479,World Football,Messi the Greatest
It seems to be you who doesn't understand that basic concept.,"Sun Dec 27, 2009 8:40 pm",41,4479,World Football,Messi the Greatest
"You just learnt your 1st lesson on the game of Football, well done","Sun Dec 27, 2009 8:24 pm",41,4479,World Football,Messi the Greatest
Evra in at LBAlves in at RBPirlo in at CM,"Sun Dec 27, 2009 1:38 pm",15,1175,World Football,Barcelona's Thierry Henry the number one player in the world
lol at vidic,"Sun Dec 27, 2009 11:27 am",15,1175,World Football,Barcelona's Thierry Henry the number one player in the world
"my bad, i thought your madrid colour glasses were referred to the messi/iniesta comments but i agree. ronaldo is not as complete as messi I find it ridiculous to suggest Messi is just a goal scorer, when that's all Ronaldo is. In that 42 goal season Ronaldo","Sun Dec 27, 2009 9:46 am",41,4479,World Football,Messi the Greatest
I saw it. Every team fielded eleven players.,"Sun Dec 27, 2009 6:14 am",41,4479,World Football,Messi the Greatest
"Oh look everyone we have a comedian!!Look at the 86 World Cup, You'll see what im talking about","Sun Dec 27, 2009 6:01 am",41,4479,World Football,Messi the Greatest
"my bad, i thought your madrid colour glasses were referred to the messi/iniesta comments but i agree. ronaldo is not as complete as messi","Sun Dec 27, 2009 5:56 am",41,4479,World Football,Messi the Greatest
"Um no, because Ronaldo now plays for Madrid","Sat Dec 26, 2009 7:39 pm",41,4479,World Football,Messi the Greatest
"that Ronaldo is the more complete player, I don't really think the votes reflect that, to be honest I think Iniesta and Xavi are a lot better than Messi, but Xavi and Iniesta are more of the type of players that set up chances and play those spectacular defence splitting balls that no one else","Sat Dec 26, 2009 7:33 pm",41,4479,World Football,Messi the Greatest
Can't be done. You need eight players on the park for a game to commence/continue.,"Sat Dec 26, 2009 6:15 pm",41,4479,World Football,Messi the Greatest
"to many people the battle for the greatest does not include maradonna, it centers around Garincha and Pele","Sat Dec 26, 2009 4:35 pm",41,4479,World Football,Messi the Greatest
"Alves is better than maicon for RB, and definately not alonso in that world XI, would rather kaka by far","Sat Dec 26, 2009 3:52 pm",15,1175,World Football,Barcelona's Thierry Henry the number one player in the world
win a world cup on ur own and then u can b called the greatest,"Fri Dec 25, 2009 12:10 pm",41,4479,World Football,Messi the Greatest
"Majority, no, everybody will say you're an arrogant, racist, keyboard warrior with no idea about football.","Fri Dec 25, 2009 11:17 am",41,4479,World Football,Messi the Greatest
"was that the one at stamford where, he stops the ball dead outside 18 then somehow gets the power on it to beat cech, must say incredible goal by ronaldinho","Fri Dec 25, 2009 9:35 am",41,4479,World Football,Messi the Greatest
Much better World XIGK CasillasLB AbidalCB PuyolCB VidicRB MaiconRCM IniestaCM AlonsoLCM XaviRST MessiCF IbrahimovicLST Ronaldo,"Fri Dec 25, 2009 3:56 am",15,1175,World Football,Barcelona's Thierry Henry the number one player in the world
the majority of ppl will say ur a greaseball,"Fri Dec 25, 2009 3:03 am",41,4479,World Football,Messi the Greatest
Top of the crop this year maybe.but top of every seasons harvest.very debateable,"Thu Dec 24, 2009 2:16 pm",41,4479,World Football,Messi the Greatest
"Each to their own, but the majority of ppl will say Diego is King","Thu Dec 24, 2009 2:12 pm",41,4479,World Football,Messi the Greatest
"[/code]Translator, Diego Armando Maradona aka Dio, is the greatest of all time.[quote]Completely disagree, Pele is the greatest player of all time. So many young people never saw much of Pele.","Thu Dec 24, 2009 10:14 am",41,4479,World Football,Messi the Greatest
"wide and create space fitted perfectly with the geometry of the Spanish giant’s passing game, and he makes an irresistible front trident with Messi and Zlatan Ibrahimovic. Centre forward Fernando Torres (Liverpool) Flutters hearts with his dashing blonde locks and looks as much as with his","Thu Dec 24, 2009 6:01 am",15,1175,World Football,Barcelona's Thierry Henry the number one player in the world
